id,user,text,rating,likes,app_version,date
7c900f53-efd8-46ac-aaa3-99259c411f2e,Nimna Nazeer,Is there baby' day out ?,5,2,,2021-08-10 10:30:26
5a503f5f-e381-4254-acc5-ed2e33bcfe8d,Bee Yu,Verry bad app it need so much data when i opened it that was saying no internet when i opend it again becose of this bad app my whole phone data finised so dont donload this bad app,1,20,5.5,2021-08-09 23:41:48
2db86b02-981b-443b-8a9a-249b0b231d30,Azna Nachu,If you want watch T. V cartoons you can download. Otherwise it didn't deserve one star. Don't download this app. I don't like this app. It also take so many mb. Waste of mb.ðŸ‘ŽðŸ‘ŽðŸ‘Ž,1,80,5.5,2021-08-02 23:59:33
ae911cee-d623-4618-a5ac-83e528e8e67a,Susan Zein,Great for the kiddies,5,2,,2021-08-01 15:15:02
36b50cae-c69d-4454-bba1-3e76465336f9,Kelisha Feliciano,I love happykids it let's you in freely and image you are a kid and you don't have YouTube or Netflix or Hulu on your tv or desktop or laptop or tablet or phone what will you do you download happykids so you can watch something that you like you know what i will use happykids for when me and my parents and my sister are in the car together maybe going out something like that and me in car and I want to watch something so badly I will use happykids i will lets us go without no internet Ilove it,5,129,5.4,2021-07-29 21:56:19
1b56e446-4d14-4d35-8bc6-d910ac8ceec3,Cayleigh Bratton,So cool love it ðŸ˜»,5,1,5.4,2021-07-29 10:35:35
87737eba-607d-4604-9385-71b0298c8fc4,Jenny,I love this app there have show I always want to watch even dreams do come true ðŸ˜,5,25,5.4,2021-07-24 10:32:20
692a1470-8a5b-4b32-97e0-0df47eda872c,Becky Husley,Good pass time for my grandchild.,4,1,,2021-07-23 03:58:12
2060cac4-4fc1-4d2c-808c-6957a04a18c5,Adam Hodgson,"Inappropriate content for children! I have a 6 and a 8 year old who both had this app on their TV. Firstly my 6 year old son watched a video of a man playing a Pegi 16 horror game! Secondly my 8 year old daughter watched a child shave their own eyebrows off with a razor! She then went on to copy this. These are two inappropriate videos for children, so I advise to download with caution!",1,49,,2021-07-22 12:22:10
92e94593-77d3-4243-841f-35a16920acba,Rob Angus,I like that app you made i woch Minecraft could you do more Minecraft video,5,23,5.3,2021-07-16 07:16:45
0cf9bb4c-4e18-4e03-bd06-934317dfde8e,Jazzy Alqhtani,ðŸ’—ðŸ’—,5,4,5.3,2021-07-15 04:47:28
90fd598c-e336-4045-8e87-a4a1d6e03577,Bryant C.,great app my nieces and nephews love to watch stuff on it when they come over,5,89,5.1,2021-07-11 14:01:47
2ef8b0d8-5e74-4648-b514-40ce2c0e07bf,Durga Manne,Please keep it in telugu,3,3,,2021-07-10 22:27:13
4eb4bb0d-509d-4818-9bc4-3e4d5e78fc8b,May Jose,"I have this on my TV but for some reason when I downloaded it on my phone it doesn't show the proper version of a show like ""winx club"" it doesn't show all of the seasons so I have to watch it on the TV. I wouldn't recommend it to people who likes a full show or picky people. For some people I would recommend ""YT kids"" it has a few shows for kids to watch but at least it even has a full season.",1,25,,2021-07-09 11:15:40
2a0809be-e71a-498d-9d66-9a9af3bf94e6,Theo Lama,"Thankyou ,it interesting nice application",2,6,,2021-07-08 15:07:06
87a23a31-f1b7-49da-8a57-8f92cbbd2c89,Miley Napier,Can you add luca please?,4,3,5.2,2021-07-06 08:10:30
d5b63cc3-8eda-4a2a-a76d-befd1b24b9c8,Ara Bella,You know what this app is soo cool and i love it so five stars,5,3,,2021-07-02 07:10:42
c001f664-2ab4-42d3-b74f-47e76382b424,Samir.,It is a a good game but its not offline please make it offline pleaseeeee,2,4,,2021-06-30 18:14:05
9729dfa0-eef8-4547-bf75-ef413c69de83,Alicia Williams,I love this game because I like watching Minecraft because I'm a kid myself and I love this app so much I love it love it love it love it love it I love watching Minecraft because I do learning on Minecraft so I know what to do,5,13,5.2,2021-06-30 10:16:15
7bf8f9d0-e519-438c-916a-23c0e399b3f6,star whisler,It is asom,5,2,,2021-06-30 01:48:25
97906a77-619a-4fee-818b-ad2b36efef8f,Ê€á´€ÉªÉ´ á´‡á´…Éªá´›á´¢,"I actually tried this app and I was about to watch frozen 2 because I haven't watch it so i went to the search bar typed ""Frozen 2 movie"", but although it just shows some vlogs so I give 2 stars, there was no movies showing.",2,75,4.7.1,2021-06-26 06:53:00
c001fa94-1a6b-46f0-bd9a-d81f775e95c5,Destiny Gunther,Angel of the chips I love them a lot are you enjoying the other chips sure thank you I enjoyed them a lot so you can't tell me what to do but I love it I love you babe babe can you communicate with me control I have forwards urgent control babe cannot communicate now we're not going to be able to come on with me shoot but are you enjoying your chips and join the chip,5,4,4.7.1,2021-06-23 11:10:05
a7d6708b-7d7a-454e-ada3-a50a777b58ec,Khan Riya985,Bablade cortoone.,5,3,4.7.1,2021-06-20 02:17:48
da28c702-c760-47a8-a552-a9fbc673ea93,gail whitworth,I am 67 and I want to say you don't have to be a child to enjoy this app god bless you ðŸ˜‡ðŸ‘¼ðŸ™ðŸ¤—ðŸ˜ŠðŸ˜‰,5,4,4.7.1,2021-06-19 13:14:47
d4d3b521-279f-4607-887a-cc0ea68c4e86,Mark Smith,Fun things for my granddaughter,5,3,4.7.1,2021-06-19 08:54:30
0cda385d-be7f-46dd-9446-df1c5ce02409,Rathnayaka Mudiynselage Sujatha Priyankara,I like it,5,2,,2021-06-19 05:12:34
ce66e9bb-9bdf-41bd-9f24-6e57450c9520,Kavi,I cannot download it. It took me more than a year since i started downloading this but it is still at zero percent,1,7,,2021-06-18 22:44:55
6157fe89-4b77-45e3-af25-274639719c80,Robin Wright,I love I love this game I just love it love it love it love it please make more I love this,5,2,,2021-06-17 06:14:21
fd8dfea2-f49b-4edf-96a9-c8a75b658786,Emily Phillips,"This App works great on my tv, but on my phone it will not work. I search up the show I want to watch and it will only let me select episodes from it's most recent season and the other seasons will not load. There is nothing wrong with my wifi either and I had deleted and redownloaded this app multiple times.",3,42,,2021-06-14 19:54:39
5e0daa6d-0588-4e9c-8bf3-32c75e0c3c73,Mary Gammons,Its not great at all because i clicked a movie and my screen was black for like 5 mins. When i cliced serch and my screen was froze,1,15,4.7.1,2021-06-14 08:35:27
0706760c-971b-4585-8d4f-f2cb43245721,Prakash Mahapatra,Very good app,5,2,,2021-06-12 03:47:54
ddbdae6c-df4d-4060-9011-0dbbebdd2866,Muhammed Zayan bin Zameer,I am in UAE,5,4,4.7.1,2021-06-11 03:22:35
e36d80b6-b432-4746-af38-9c6bcbdbfa54,Gucci Gang,cool,3,4,4.7.1,2021-06-11 01:01:07
f856ba8a-d179-4b86-8081-89f9d593c6d9,Shyma Shyma,AshiL,5,2,,2021-06-11 00:10:46
a06afc8d-059c-462c-9779-f56d73440826,hildan orejola,This app is so cool,5,2,,2021-06-10 05:48:10
a1d77f36-7dd1-403f-be38-e81ff9e834f2,Sasha Mac,"Bad experience. After i have fownloaded, it doesnt open",1,8,4.7.1,2021-06-10 04:12:01
615e2f74-3b8d-4bac-9424-1cc3c3519480,joan pinero,That's good,5,2,,2021-06-09 07:47:09
92ed435e-e3d8-4b93-81b4-587a4a492ea4,Salmia Nuharibain,This app so boring i don't like,1,5,,2021-06-08 04:01:21
5cbb8109-ff95-40a7-91fc-eb60820decfc,Brandy Reardon,It's a decent app. Unfortunately my daughter only really watched Cocomelon on it & is hooked. Now all of a sudden it's no longer available. Now I've got a crabby toddler.,3,19,,2021-06-07 16:35:33
d6f024f1-8f0f-4caa-9094-a1d221dbf887,ShawanaMsChelle McCormick,The reason why I put all five stars in is because the app gots ninjago lego And everything I want to watch.,5,2,,2021-06-06 19:07:18
f28ea670-6305-403b-97ce-be25929a7045,Kishon Michael Singh,Great,5,2,4.7.1,2021-06-05 20:20:09
a0d88345-8da5-4fd5-aa1a-ed9563c89dfb,Zyjhoe Lian Benito,My sister is gonna love this 5 stars,5,6,,2021-06-05 08:10:11
c9bbf8b7-28c3-49b5-a5b2-63c75930930f,Michelle Hanna,This is a great app with a lot of options of things to watch and its 100% free and safe!!,5,12,4.7.1,2021-06-02 22:57:14
095ae14a-ea3f-4993-9b67-018c4ecd851a,Shoma Barua,I LOVE THIS CARTOON VERY MUCH BECAUSE KIDS CAN LEARN AVERY THING ABOUT THIS NEW CARTOONIST PROGRAM IN THE WORLD OF ART AND CRAFTS SOON IF THEY GROWN THE KIDS WILL LERN AVERY THING NEW SO THAT'S WE CAN RAST.,5,15,4.7.1,2021-05-29 11:52:27
f4d77188-3c3c-426c-b6b8-a72a40c9f3f2,Vanessa Burts,My grands love all the shows on here,5,3,4.7.1,2021-05-28 20:26:02
0d286c46-4140-4c09-9c39-8aef1bcf0809,Philip Napaldet Jr,wat ha piyd Happy kids no open ay well,1,3,,2021-05-27 17:14:26
1f96acdb-1ff7-4b70-bbd2-d80501bc61aa,Adrijana Bronner,My kids love this app and it's so educational they have educational video and my kids just it's just magic to my kids,5,15,4.7.1,2021-05-24 11:21:33
2a9a31b0-6dbb-4835-969f-9efe07e76759,Kaylah Ogden,App won't work on Chromebook. It'll load up but that's about it. Nothing else will work.,1,98,,2021-05-23 10:41:53
8b5983e5-6b24-42cf-8983-8a387087fe19,manish sharma,Best app but more videos in Dr squish very very very very good app,5,9,4.7.1,2021-05-23 04:18:41
c605d7c4-e377-4f35-b3db-590a0390d361,Hridya Pradosh,when I open this it tells that connection failed,1,7,4.7.1,2021-05-22 04:05:34
e88ac64f-b387-4d1e-b2fd-c454a6c7f32d,Cristine Pablo,i like this apps beacause my nephew like it and enjoy it,5,3,,2021-05-14 18:31:28
5ae8ca31-2628-4a81-9ae1-76f442d72195,BABURAJAN C,Verry bad application for kids,1,4,4.7.1,2021-05-11 23:30:02
c00b1a47-8289-4e49-a7b5-219e8caa990c,Han (Vlein),ðŸ˜˜ðŸ˜˜ðŸ˜˜ðŸ˜€ðŸ˜€ðŸ˜€,4,3,,2021-05-11 11:21:33
8803d083-6ebe-4f07-ada4-130c8e152bce,Kylie Balasolla,This is good for my baby â™¡â™¡â™¡â™¡â™¡â™¡â™¡â™¡â™¡â™¡â™¡â™¡â™¡â™¡â™¡â™¡â™¡â™¡â™¡â™¡â™¡â™¡â™¡â™¡â™¡â™¡â™¡â™¡â™¡,5,2,,2021-05-10 00:01:23
6f1ec423-88c6-4435-a910-0ade10f76444,Shruti Tomar,I like the app very much.,5,5,,2021-05-08 06:36:49
77241e06-383e-4a39-8010-6ebe9f1b6890,ben ellis,It's very nice for kids,5,5,,2021-05-04 12:59:41
14d5b4d0-a4ee-46cf-95ff-d1783d61cd0e,Cornell Lewis,I hate it,1,4,,2021-05-04 10:56:58
95ca2b7e-a203-406d-81be-f63590788dd1,Sierra Miles,I like Talking Tom and friends but I see a picture of Talking Tom and Friends season 4 but when I look at there's no Talking Tom season 4,4,4,4.7.1,2021-04-26 12:51:38
a197b2e6-68cd-4fcb-90ea-1921fffb10df,Bryan Edwards,I WOULD USE THIS APP FOR HOURS IT IS SOOOO WORTH IT.,5,2,,2021-04-26 09:36:17
7b83795a-9a41-4d28-9edc-0a1a2b7058ed,maribeth brabo,Is not happyðŸ˜¡,1,7,,2021-04-26 05:11:02
c21766a3-f056-4d9b-b338-e623c3b4f013,Rose Mawa,I like this app,5,3,,2021-04-25 04:58:01
c2436de6-212f-44cd-a0a5-27024cd0ff12,Kenneth Von Aschen,Horrible,1,3,4.7.1,2021-04-24 13:40:25
ee774e4a-a058-4688-9796-c8561c4b1ffd,Digicom Stores,ðŸ˜ ðŸ˜¬ðŸ˜¬ðŸ˜¬ðŸ˜¬ðŸ˜¬ðŸ˜¬ðŸ˜ ðŸ˜ ðŸ˜ ðŸ˜¬ðŸ˜¡ðŸ˜¡ðŸ˜¡ðŸ˜¡ðŸ˜¡ðŸ˜¡ðŸ˜¡ðŸ˜¾ðŸ˜¾ðŸ˜¾,1,9,,2021-04-23 17:58:14
2127f452-22f7-413a-bfde-83a633e81794,LAUREL MLAMBO,Good app,5,2,,2021-04-22 06:51:52
0b6f0bea-44b2-48cc-8a98-589b9d8fd179,Diego Herrera,Awsome,5,2,,2021-04-21 19:40:30
49608c3b-a21b-4a0e-954d-6c613cbe3e29,Venus Whitehurst,Alright your gonna laugh but I don't have kids and im a grown woman. I downloaded it on my router just to watch the winx club for free and I love it.,5,9,4.7.1,2021-04-21 09:27:29
b20b34b7-565d-4ad1-9982-e7a5c4850fa3,Alyssa Ougrah,i loved it on my phone but it doesn't work properly on my laptop so please get that fixed,3,4,,2021-04-20 07:57:37
df7a1fea-af01-438c-bce6-8e49d2286c28,Walsh,This app is out standing and for anyone to ask me about this app i wouod deff recamend this app for 13 and under this app is amazing you should toats get it i am not a robot and i do not work there.ðŸ™‚ðŸ™‚ðŸ™‚ðŸ™‚ðŸ™‚,5,6,4.7.1,2021-04-13 13:35:53
ae46a9b2-653e-4812-ae6c-c104a6b07020,Se Kolah,This app is great but my sister boring wiht this app he can t fine the teen titans show and my little pony pleas fix it,3,5,,2021-04-12 21:06:47
1e728824-c46d-41b9-983f-1bc27d564ef1,DIANA TORRES,Great job,5,3,,2021-04-12 18:55:38
a30c872a-f590-4c6e-aef1-1157e6bd413d,gloria Gutierrez,My daughter girls her likes so much just,5,6,4.7.1,2021-04-08 17:24:23
d5688dfc-3cc3-4fc3-b62a-1880d89bb1ba,Akhtar Munir,Xxx and,5,4,,2021-04-05 10:06:14
da7c4e4d-5c7f-414c-82fb-83d4efdc4ad7,Ramon Johnson,Seems great,5,2,,2021-04-04 07:13:25
49fc658d-5248-4e2b-a39f-1c5e5125617f,heather tumala,I like this app....my daughter likes to watch videos in this app...so i give 4 stars,4,7,4.7.1,2021-04-03 02:53:05
7655f0ce-f168-41ce-b018-f317e8b28f51,gorgeouse,Cool for me I like it,5,5,,2021-04-02 05:51:33
93b20ec8-8008-426d-ac4e-0204972c93e1,Nadia Shafiq,I just installed it now but I give 1 star because when I open the game it always says that: â€œFailed to contact. Try again later.â€ I have internet and signles were also very good. The game has an issue. Please! Check the problem. I installed this app very happily and now this issue make my mode very sad.,1,274,4.7.1,2021-03-31 06:26:28
4b1f7be2-94dd-4f48-9d07-443b9cd8867f,Abeera Ali,"This app is not great that muchðŸ˜ŸðŸ˜¦first is that when I write Ryan, furniture for dolls or how to make a doll house the vedio is not right and second when I touch the icon today on march 30 it had lot of buffering but my internet was on I want to see elena and clara really much or make a same website in playstore but with no buffering lot right now",3,106,4.7.1,2021-03-31 01:41:53
4cfa6343-d750-4aa5-9b21-8fcfdd537657,Josefata Soqe,Owsom app for my grandchildren thanks,5,2,4.7.1,2021-03-27 22:13:00
c0232ee9-3a19-4378-8c40-162857d05ddc,Beth Lammers,Tots,5,2,,2021-03-27 19:36:26
d486d60f-533a-42d7-85ae-2cb49a1ce45e,XD Gaming PLAYER,Ridiculous,1,4,,2021-03-25 20:50:35
96475a40-474e-4ed8-9b7e-590215e07743,Julia Kleber,LoveðŸ˜,4,4,,2021-03-25 09:01:21
87f3faba-859b-4cac-b27b-cb6c22bf9057,Martha,"Love this app, for babies and bigger children, nice app for kids learn alphabet, to count, sing, it fun. I use it for my granddaughters. My granddaughter learned a lot from happy kids. Thanks happy kids. And what great it a free app.",5,206,4.8,2021-03-24 13:50:21
0aa7f85b-41fd-4e14-b00e-f4d35c8a7651,PrathviiXD,"Excellent App The Show I want to watch, in this app I can watch â˜ºï¸â˜ºï¸â˜ºï¸ ðŸ‘ðŸ‘ðŸ‘ðŸ‘ðŸ‘",5,3,4.7.1,2021-03-24 00:09:02
49c0cbdb-ae56-44d6-8d0d-e5d51b42e5e2,Katelyn Tallam,ðŸ˜ðŸ˜ðŸ˜ðŸ˜ðŸ˜ðŸ˜„ðŸ˜„ðŸ˜„ðŸ˜€ðŸ˜€ðŸ˜€,5,5,4.7.1,2021-03-20 08:33:16
f297ed53-f1e6-45f0-b66f-c25c41c091de,Ej Florendo,ðŸ˜†ðŸ˜†,4,3,,2021-03-16 22:04:10
95884210-5093-48e4-a6b1-d45d344a80c1,Ruth Tiego,Th I is a really entertaining game,5,4,,2021-03-16 10:19:02
fd5d37f2-1be7-4739-8c3d-fa6aa546cdfb,Julie Etheridge,Love kids,5,2,4.5,2021-03-12 13:23:19
5e1a56a2-89ef-46aa-8933-c1d4bf812108,homosexual feminine male confessionist slut,sexism,1,3,,2021-03-10 09:21:09
1d7623f0-eade-4609-b39b-ba0766ce447d,Dee Saved,"Saw Bible Songs app on Roku and the children loved it. It stated that I could get the app and I put it on their tablet, but it's all secular! No warning. ðŸ™",2,16,,2021-03-08 03:28:24
12016138-9a9c-45c2-9196-eccfa9a5ca4f,Debeleze Ezenwile,Excellebt,5,2,,2021-03-06 13:25:47
c3d2a2d2-d620-44e1-9d85-ce8878857825,danny myu,Wow,5,3,,2021-03-06 07:30:25
6a4d0028-d71e-4ef4-b686-7f6ddd133709,Chrisjhon Plantar,Good,5,3,,2021-03-05 00:05:13
c3baa4e7-1a48-47f5-8fda-5e888b69be55,QUINNY HARLEY,I WILL SUPPORT THIS APPS FOREVER,5,1,4.7.1,2021-03-03 02:30:53
70b150bb-75cb-49fb-b7bc-dc0fd9cf178c,wendy B,Great,5,1,4.7.1,2021-02-28 11:56:33
c3a9202d-53d0-42d1-b5d6-88b162d69e51,Olivia Abacan,"after the last update, it doesn't work well. can't even watch videos. i switched to kidoodle tv for now.",1,142,4.8,2021-02-26 05:32:11
f70a1102-5fc7-4d4a-b6b3-9e08635b461c,Sabrina Coady,Sister made it,4,3,4.6,2021-02-23 15:46:46
514dec27-7947-4737-bf18-acf678c59f67,fevalyn torayno,Thank you,5,2,,2021-02-22 04:16:34
df122fac-dce7-4be9-83cc-f9d6165f07ad,Bophelo Ncube,I love the app and my kid likes it a lot,5,6,4.7.1,2021-02-20 11:40:57
9a2429b0-9595-4616-adba-873f60b52f00,Joe zeay,Safe and wholesome,5,5,4.8,2021-02-20 09:04:16
197d7deb-9fde-4b76-b9cf-34b917cf5cde,Izz irfan,SO good,5,1,,2021-02-16 07:00:50
51758e77-aecd-4a46-b641-7e2018561181,Mikera Bowlding,i don't like this app bc when i got it i tried to click on what i wanted to watch and when i did it did not work so sry but i don't like it,1,10,,2021-02-14 00:04:38
9e9aaf8f-ebdd-4802-9921-b8ceacf00f8f,Eben Ezer,It boring it dose not show peppa pig onley blilly hate make it beter,1,4,,2021-02-13 06:38:04
db3cd1f4-c72e-4014-9c67-4e40aabd0980,EAR SAMOSILA,I lek it,4,2,,2021-02-12 00:25:36
3c9ca5e2-7085-4036-bed2-b18717c28f12,Amina Sabar,Nice app my brother is so happy because it is perfect app thank you for this app,5,2,,2021-02-08 04:05:29
7ffb63d6-1702-46ea-92c1-6bc06126b63a,Sans Bone,Now that we can arrange to have an ðŸ‘Ž,1,4,4.7.1,2021-02-05 17:53:52
4e96efb0-5ac3-4349-b74b-7ff381e0b21e,Manda Jones,My kid looooves Badanamu. Like... He loves it. Today there was a problem with YouTube and the entire account that has the videos was deleted. Someone on Facebook recommended this app and I couldn't be happier. My little guy gets his educational screen time and I don't have to hear him asking is it's back on YouTube yet. ðŸ˜‚ Thanks you guys! Such an awesome app.,5,234,4.7.1,2021-02-03 17:04:28
0a4bd900-1506-4741-8880-3187a1561dd9,star Mix,WOW WOW,5,2,,2021-02-02 11:10:33
34ca5843-42b7-4948-8735-e16b9bde7cc4,Sagheer Ahmed,"Good app but no another cartoon like roma and diana ,vlad and niki",4,14,4.7.1,2021-02-01 02:41:08
01bfc843-7239-4529-b2db-23887367583c,Sheriza Mohammed,I'm not getting movirs for my age group,1,5,4.7.1,2021-01-31 11:59:46
508d6ca6-0247-4f04-8e74-9d99c395ef75,sumit kumar,Very good for kids,5,3,,2021-01-31 06:56:31
ef6dcb1a-f924-4f6f-9634-7b2f2f89d1d9,Kelly Hall,Awesome,5,3,4.7.1,2021-01-30 09:21:32
d855c44e-a0e9-458b-90b6-d04324751765,Madison Roth,It has 1 pbs kids show and it only has 6 episodes on cat in the hat and then they have Sammy's adventure 2 but they don't have part 1 so that does not make sence and lastly they show that they have Strawberry shortcake but I have been waiting for a while and the episodes never showed.ðŸ˜ ,3,127,4.7.1,2021-01-30 07:02:46
cf00527e-2537-40d4-bd3c-d51376d205aa,Lana Wallace,Love this App for my grandbabys.,5,9,4.7.1,2021-01-30 06:45:18
11c57333-ba32-45e2-b3c4-bdafff3e5996,Naya princess,Love it,5,4,4.7.1,2021-01-30 03:53:54
9e43a30d-1d77-4c2f-9afa-568ad023c235,Liam Manuel,I love you contact,5,3,4.7.1,2021-01-28 16:00:13
5ccb5ed7-0868-49e2-8526-c37b4d259daa,Joshua Ngethee,It's great app for my kids,5,9,4.7.1,2021-01-27 11:25:28
c7c44a11-01ea-414c-8cba-c35efda8a48f,willie pye,i love this app because you can watch all of your favorite show like bugs bunny and oddbods,1,9,4.6,2021-01-26 10:35:18
96155ef2-c009-43b3-affd-0d020d85de44,Liji T.A.,I love this app,5,2,4.7.1,2021-01-24 23:23:11
28d78e00-cf3e-4c9d-a417-00e06cf89297,sheetal Chahera,Nice app but shows that there is talking Tom and friends but really it is not available but my daughter is obsessed with talking Tom and friends so please add it otherwise good app.,3,101,4.7.1,2021-01-24 22:56:58
368f86a9-e4c6-4e77-b90c-32f3c502e196,Kirk Graham,Go,5,5,4.7.1,2021-01-24 13:25:11
4725e523-afe8-4b9c-9aab-a31b03636aa1,Mueghe Amstrong,.. U.b . b+!,4,2,4.7.1,2021-01-22 00:46:39
403f55d4-cf95-4419-a53f-ce3e60f47c93,Gene Aguirre,"For dannels information, i am 8 years old and i absolutely LOVE this app SO amazing. And i hope you dont take affense.im only in 3rd grade.",5,23,4.7.1,2021-01-21 21:41:40
b8f580c2-bd10-4f10-9f04-ec1eadf218ae,KiLO,Not sure why others are unhappy but this app is incredible no ads or junk!,5,54,4.7.1,2021-01-16 17:35:58
770ee860-5c24-44a9-87ed-2c367746a12d,Comfort Sarpong,Cool i like it,5,2,,2021-01-15 06:26:08
dad45f68-de25-41f6-b25d-0d5f009c73d4,BB 1999,memories,5,2,,2021-01-11 17:31:38
61992a9d-38fa-445b-b8f7-56d854b4297f,â€¢kawaii gurlâ€¢,I really really love it thank you so much!,5,5,4.6,2021-01-10 19:30:27
97d26e87-352c-4f57-bd3f-0c10a0b7d752,Kate MacLuskie,I downloaded it onto my chromebook. The app would open but not play videos at all.,1,26,,2021-01-08 23:45:38
e86d8258-1b5c-4785-8ac4-11b71bd10958,victoria,Horrible app dont download,1,4,4.6,2021-01-07 23:19:19
9bc7720a-a835-450b-a5da-2414b09bf283,Hanady Aburob,We can watch oddbods,5,4,4.6,2020-12-31 11:01:47
8298e32c-c82d-4d98-8bad-ff2400611c66,Lucinda Arthur,I loved this app i like all of the shows like the show talking tom and friends It's an amazing app for your kids I would definitely download this app,5,12,4.6,2020-12-30 23:46:04
da7223e0-ecf1-4f45-bb4a-51a5608b2cc4,David Morton,"If you want to watch people eating feces, this is the app for you! If you hate your kids, then you found the right app! If you think your kids are the biggest suckers you ever met, download this app! If you don't get enough advertising of plastic junk in your real life, get this app! There, I just summed up the entire experience you get from this. Everyone involved in the production should be absolutely ashamed. Your child has created better content from pasta and a paper plate.",1,36,4.6,2020-12-30 09:14:05
67580ac6-4d93-4139-9b52-a4a1ec20eb8c,Mahmood farook,Hajar!!!!!!!!!!!!!!!!!,1,5,4.6,2020-12-30 03:01:35
a915b5f3-a08e-4205-a526-0bfa8a5071f0,Unicorn Icecream,Ooooommmmmeeee??????ðŸ™ŒðŸ™ŒðŸ™ŒðŸ˜‡ðŸŽ…ðŸ’–ðŸŽ‚ðŸ’—â­â­â­â­ðŸ’,5,4,,2020-12-26 20:15:43
5c39b4bb-fe29-4793-a901-12a4e0a4b5ed,Cierra Arrendale,It's mostly commercials,1,6,,2020-12-26 14:34:34
baf3c73c-47f8-4589-8d34-5d4447da9be0,Rowel Delicano,Rhian ebarat,1,2,,2020-12-25 20:45:38
68edef44-99ee-4b66-a4e5-3abb80fd3dc6,Shashirekha Dash,"I can say it is a very good app but unfortunately, the app does not have cartoon like PokÃ©mon, shimmer and shine etc. Sir, I still can't find PokÃ©mon in your app",4,40,4.6,2020-12-22 21:48:35
686b95b3-2d87-464e-b8e4-f1890de13d79,Hailey Long,It is really good so I think they should put more stuff love app,5,3,4.6,2020-12-22 05:37:38
d6b3a8c0-e5e7-4e93-b37e-db5c00555f51,Wendy Britt,Happy Kids And YouTube Kids Has A New Show Rilynn And Pig Show Ages 1-8 But Kids Needed Permission For A 9 Day And 1 Week Trial,4,4,4.6,2020-12-19 12:08:50
8faca685-0744-41d2-b218-40e4b734f57a,rayan mohamed,Malaz,5,3,,2020-12-19 02:32:09
4208208b-8423-4903-8d9a-1862ff10b39f,Teresa McCain,Hey what about me it won't let me search shut up i askd my mom to get it on roku channle so lets see what happens...,1,5,4.6,2020-12-18 19:49:25
a326dd9f-16aa-4bf6-a38f-a909cd4b64d8,JULIE SUMA-OY,So very happy,5,3,,2020-12-18 18:28:28
ccaf5271-c9c0-4f70-b9d0-c7a72dc88898,Cascian Loonam,"I have this app on my roku an it works great, the phone version however is awful. The same shows that are available on the roku version are not available on the mobile version. The mobile version is also glitchy and not as easy to navigate as the roku version.",1,29,,2020-12-17 15:11:58
a92cd28f-47d6-4ade-aef0-aa048c8f1089,Nomfuza Cungwa,How do we download in this?? Please somebody answer meeðŸ˜¢ðŸ˜¢ðŸ˜¢it's not funny please answer me,1,4,4.6,2020-12-17 07:50:27
b46231c9-17d4-4e25-bca7-8ceb0a53b3e7,Krystal Morrow,My child loves it,5,2,4.6,2020-12-16 16:06:21
46810c74-f2fb-43fb-b979-1c59fbfe9db6,Jose Rodrigez Martinez,Most popular,5,3,,2020-12-13 21:53:54
46234500-3537-4c68-93e9-e6779633e489,Alicia Dannawi,Ø£Ù„ÙŠØ³ÙŠØ§,5,2,,2020-12-10 12:14:47
eaeae8bf-58e4-41f9-a5e5-6878ef9b7f81,Kelly,I RECOMMEND DOWNLOAD THIS APP!!!!!!!! LOVE ITâ¤ï¸â¤ï¸â¤ï¸â¤ï¸,5,4,4.6,2020-12-09 16:03:54
9c3ad2ff-0ef7-4125-8d77-cd68a1a80d6e,Alicia Shaw,Though I can't turn on a show on my tablet more Abdallah smash videos,5,4,4.6,2020-12-09 12:30:27
8f250501-dd56-4926-bfe8-6f6e4997c16f,Monu Kumar,Goswrk,5,1,,2020-12-08 01:42:51
aa7c84e6-06ef-430c-b755-2d07574a30ce,Benedict Afrim,Help kids to watch cartoon,2,4,,2020-12-07 12:50:25
063d4e1a-d80f-4629-b149-d90ed6a98698,Anyiah Mckay,"Pretty good , but I think this app might have a issue . Thats why I coos a 2",2,8,4.8,2020-12-07 07:40:15
5036c5eb-958c-4bc5-b3d7-c897e6d14959,Joseph.D,Nice ðŸ‘Œ,5,3,,2020-12-05 08:46:51
4bebbfbc-3860-4a22-8f8d-7b4a54ea2607,Salman Mohammed,i love it,1,6,,2020-12-04 01:53:30
b944ab21-6cd4-42cc-8c0d-2e34681aeed7,haroon fayaz,awesome,5,2,4.9,2020-11-30 00:17:05
e5740363-a139-475c-b0d9-be0459670741,Lily Sumi,So fun,5,2,,2020-11-27 06:18:46
080ee813-9429-41fa-bb0b-b6178fc32f41,Jamilla Deons,Happy New Year and happy Valentine's day and happy Patrick's day,5,3,4.9,2020-11-26 09:22:05
78f9e008-f749-4820-8277-84a2d1eb7840,Bo Greber,bo Mom,4,4,,2020-11-19 11:28:26
d651651e-dfd1-456b-bf4f-c5c080508fbd,Uche Nwankpa,OMG,1,3,,2020-11-19 08:34:20
9a6634f1-c405-4778-911d-d804353f65f8,Roxanne Ovilla,I love it,5,2,,2020-11-19 00:40:40
9a44006c-107c-43f5-a9eb-2d0c0621fd25,Umme Loeeza,Nice app for kids,5,4,4.6,2020-11-16 01:35:24
ab4866cb-22e7-4fe9-9745-2ba1a0a1418f,Priyanka Alam,It is a very good app for kids I really like the appðŸ™,5,3,4.6,2020-11-15 21:26:58
444d19b0-59e4-4c07-aa86-12a3eea2c5b1,Madrid only-_-,i really like this app and btw i am 8 years boy its so fun its makes me happy guys i aways watch bear bears spongepop and garfilled hope have a nice cool dope days i wish peace out,5,7,,2020-11-15 05:19:01
7245f15d-74ae-4385-80cb-646e81bd882c,ROOSEVELT ANGELES,My 3yo son likes it...,5,2,4.6,2020-11-12 13:11:42
0f504237-7c5c-4f2a-89aa-2505d5e19867,Diego Haro,Cool Kids app,5,3,4.8,2020-11-11 10:07:45
a8a21e19-4dc7-474a-8966-cb090092a780,Jamie Barnett,One of my favorite antb thing in the world I love it the best,4,9,4.9,2020-11-09 17:29:32
181426a5-3be1-4f24-8724-6c8d396cfb7b,Yonis Waed,i love happykids bye,5,5,,2020-11-09 07:57:08
