id,user,text,rating,likes,app_version,date
dba59685-5f2e-4866-b8d3-ec346bf4c992,A Google user,Good,5,0,4.25.3,2022-07-24 04:45:37
99569e22-a574-48ad-b26d-f6db08148263,A Google user,cool game,5,0,4.25.3,2022-07-23 23:38:13
2e834812-bd60-4abe-b881-0d615ab72e85,A Google user,Good game but suffer from all the commercials... also pay to win,4,0,4.25.3,2022-07-23 15:06:23
ef900786-ca84-4b05-8e43-8789ac9151ad,A Google user,Nice game,4,0,4.25.3,2022-07-23 00:11:40
9980717b-5718-450d-b00b-f1e3a2edf828,A Google user,Solid game play,4,0,4.25.3,2022-07-22 21:01:37
19b078bc-42ea-4f83-8fab-12abac5e4cb0,A Google user,You pay money and get extra powers (wearables) to defeat others.. Pathetic.. Instead after a couple of days please put a user fee as fair practice,1,2,4.25.3,2022-07-21 21:29:21
e29566f6-c95a-4dfa-9502-d5b5ff2728da,A Google user,Very pay to win oriented,3,0,4.25.3,2022-07-21 20:11:00
bcadbd23-5b17-4c4d-afd1-386660a409b0,A Google user,Good strategy game,5,0,4.25.3,2022-07-21 15:52:38
c15dfaad-eafe-4d6b-8c6d-2f483f00ffcc,A Google user,"This is a PC game that crosses platform. Mobile users are very limited. We are playing against household computers. The ""freeze game"" glitch still exists after countless reports. The developers don't care, they just want more money. It's a waste of data, battery, and time.",1,0,,2022-07-21 10:54:15
269954f5-b4e2-4a46-9315-ca29b5eea79f,A Google user,Very fun game little disappointed in only way to progress is to but the full game but multiplayer mode has gotten me to continue playing. Highly recommended getting for time killing. Otherwise great game. Still good.,4,0,4.25.3,2022-07-21 09:38:28
bb1e3948-43fb-471e-be61-cd7d265504bf,A Google user,So so game just don't wanna buy to play more,3,0,,2022-07-21 03:19:39
04007f33-1924-4a69-8a1e-623d886e598c,A Google user,Love it! Can't stop playing,5,0,4.25.3,2022-07-21 03:18:30
10398fbb-f4ae-4453-a3ea-db6d1c1804d4,A Google user,Adictive awesome,5,0,4.25.3,2022-07-20 23:51:44
ebf35d20-e655-4308-b881-57746125a280,A Google user,Awesome game. Highly recommend.,5,0,4.25.3,2022-07-20 15:16:12
5ec83d91-7052-4edf-9ee4-ef111af5a550,A Google user,"THIS DEVELOPER IS A FRAUD THAT STEALS MONEY. I've tried to contact this app developers for a refund for a puchase that my son did by mistake... they don't answer, there is a bot that always says that they don't make refunds..... they are stealing my money, a big amount in fact, and they do not give any help to costumers and the are expecting that people get tired of asking for the refund.",1,0,4.25.3,2022-07-20 10:29:26
cda5c920-77db-49aa-ac8b-ce9816316ed8,A Google user,Great game got a lot of potential,5,0,4.25.3,2022-07-20 07:49:32
4f6973e5-f108-42a8-910f-bf61ffcb5a4b,A Google user,Bloody good game,5,0,4.25.3,2022-07-20 06:11:14
9b5a2101-bbf2-4033-bde2-cc99c1ee089e,A Google user,This game are very good game because it's the features and graphics are very good.. and i am very interested in this game new stretegy and new things are based.. this game are fantastic in my experience..,5,0,4.25.3,2022-07-20 01:28:49
d0b60398-a435-47b7-a335-2151162a2165,A Google user,I actually love graphics of the game new Palace tuff enemy lovely mushrooms 🍄,5,0,,2022-07-19 22:20:46
59ec6893-fd77-4ab1-9a14-dc7cc524e695,A Google user,This Is Not The Game That Was In The Ads,2,0,4.25.3,2022-07-19 20:02:48
ab13a101-3258-49bf-b683-2a83be92f7c1,A Google user,This game is always trying to make you pay for things I mean a $100 purchase?!? What the hell! This is a game of fear of losing out. Amazing strategy game if it wasn't for all the in app purchases. Constantly advertising in app purchases...,1,0,4.25.3,2022-07-19 07:13:19
f557113f-cfb0-4c34-b3fa-4f2604b6031b,A Google user,"The game is loading i can,t play it but why i,m still confused and angry about waiting i,m only playing other game 😡😤😤😤😡😡😡🤬",2,0,4.25.3,2022-07-19 01:51:06
fbaab275-82d2-4559-961e-c2cb42c78216,A Google user,Nice game..,5,0,4.25.3,2022-07-19 00:47:35
9ac1abdb-5b88-477c-9daa-1733fb86ff81,A Google user,Great game if it did not cost so much to play it would be great! Premium is price for a monthly bonus and having to pay to do the solo game was really a let down.,3,0,4.25.0,2022-07-18 22:44:53
e1577b3d-4569-45f1-83d7-b1cf5ac99339,A Google user,nice,5,0,4.25.3,2022-07-18 08:14:50
3d573717-723f-478a-acbf-727923878899,A Google user,Great game,5,0,4.24.3,2022-07-18 07:19:09
1c82fa27-e06a-45e7-bb25-dcfb59e77e15,A Google user,Fun game to play,5,0,4.25.3,2022-07-18 06:12:53
f80ace80-0a41-4fdb-ae44-9ec3591027a1,A Google user,"Very nice game (on paper) but is too much ad/cash oriented. Upgrades, traits, forging all cost too much. You end up spending more time watching ads in order to get some extra cash and chests than playing the game itself. And when you DO manage to upgrade your hero, you have to watch ads in order to get your charges up and play. Nice game but you should really consider going easy on cash/ads dependency",4,43,4.25.3,2022-07-18 04:12:00
a981c2d2-1061-463b-91c1-c756123c9e14,A Google user,I've had the season pass for months so they already have my money I loved this game one of the few I sunk money in it is now a shameless cash grab full of ads I would not recommend and I pity my friends who have already downloaded this ad filled swamp shame I am uninstalling it before the last season dropped... sadly I thought this last update was the new season but no just a way to get more ad revenue RIP MW2,4,9,4.25.3,2022-07-18 00:54:18
497dab57-06e8-4add-8f27-54d72afaefcd,A Google user,Pay to Win,2,0,4.25.3,2022-07-17 15:58:47
7e5ca84b-8284-4053-9860-3548acd13586,A Google user,I had been playing this for 2 years now. And the updates is ever exciting. More and more simple function and characters comes out. No need to spend any money if you don't wish to. But highly recommended to jz buy the full version once. Started playing on July 2022 with my new zfold3. Amazing quality screen and 60fps. Smooth....,5,3,4.25.3,2022-07-17 14:49:55
1f914bd0-bda8-49d0-8fa7-5f840cfad35f,A Google user,Fun game. Well done.,5,0,4.25.3,2022-07-17 10:42:47
9ee2d305-df88-463e-be05-c783c0a16051,A Google user,Pay 2 win,1,0,,2022-07-17 10:00:29
19291f9e-2912-4ab8-a639-e79367e917c4,A Google user,Beautiful game thinks for this game..,5,0,,2022-07-17 00:33:04
2bc09300-e6bb-405c-b7cd-85f67261584d,A Google user,It is good. I enjoy playing,5,0,4.25.3,2022-07-16 20:09:38
8ab4f385-55bb-49a1-ac05-3aac863f869f,A Google user,Unique dan game yang seru.. must to cobain,5,0,4.25.3,2022-07-16 12:51:09
ae1f697e-5ee2-4340-bf72-1ad074a57e92,A Google user,"Good gameplay, interesting characters and different types of special abilities are pretty cool too.",4,0,4.25.3,2022-07-16 10:16:20
f7274bc2-d4d7-4e56-8725-8c6ededbe63e,A Google user,Good game play must buy game for full levels,4,0,4.25.3,2022-07-15 21:48:42
2b51e3c6-aae0-4f6d-9835-73d86e0501b2,A Google user,Awesome game,5,0,4.25.3,2022-07-15 17:45:55
0ca2f925-365e-4811-a1fb-00288f84e732,A Google user,Love it!!!!,5,0,4.25.3,2022-07-15 12:54:12
7c73fd67-3af1-4e63-b15d-c653d68826f7,A Google user,"Good game but campaign needs to be longer, the coming soon has been like that for ages",4,0,4.25.3,2022-07-15 10:24:11
af93464e-2dad-44d0-af6b-ffb2ed703c70,A Google user,It's a great game,5,0,4.25.3,2022-07-15 08:20:22
10d98bf5-cb44-47f7-99c9-fb7c085e261e,A Google user,Nice game,5,0,4.25.0,2022-07-14 21:58:13
97b2e6f1-c541-4cff-9723-15f206cb6643,A Google user,"The recent pay to play items have really upset the game balance. Quite a shame, used to be a lot of fun to play.",3,1,4.25.3,2022-07-14 20:53:14
39ce2b15-36c7-4fc4-92c5-8d50ec3669ff,A Google user,Downloaded this game out of curiosity and now I am hooked I spent almost a whole week playing this game non-stop literally I only slept for a couple hours and got up just to play it on vacation from work this game is absolutely great I never thought I would be playing it still 👍🇵🇷 💯🔥🔥🔥🔥🔥🔥🔥🔥🔥🔥🔥🔥🔥🔥,5,0,4.25.0,2022-07-14 19:00:31
6114bd11-d087-4d1b-8c5a-8af1efd15350,A Google user,Good game,5,0,4.25.0,2022-07-14 14:38:10
b15452b9-fa6e-43ec-9d22-fd51ac32c0fe,A Google user,Heflin snarf blast this is fun,4,0,4.25.3,2022-07-14 13:40:15
3ece7387-d00b-40db-95ae-bf05ac06ac64,A Google user,not simple,5,0,4.25.3,2022-07-14 11:50:39
42627403-d176-41a9-bbe6-991228fa93aa,A Google user,It has been a really fun game to play not often do I get a phone game thats competitive and fun.,5,1,4.25.3,2022-07-14 03:16:30
adce8353-a34e-4dea-a44a-930c1cd4e1b7,A Google user,"PAY TO WIN GAME, WHAT A FREAKING STUPID GAME, and before judging me, I played this game for 4 years, and every time they're proofing it's a pay to win game!!!!!!!!!!!",1,9,4.25.3,2022-07-14 02:42:49
a3be2366-2a4f-4359-a6ab-833908e643b1,A Google user,Multiplayer is fun and great. Single player is GARBAGE. The enemy is so overpowered. Cab you not increase difficulty without making 2 enemy units beat 50 ally units? This is so stupid.,2,1,4.25.0,2022-07-14 00:26:51
0c33d31b-6b11-45c4-915b-e6a611ee08d1,A Google user,Grate fun,5,0,4.25.3,2022-07-13 23:57:05
321ad56d-17f4-4a5e-b95b-c1b90191ca20,A Google user,Great,5,0,4.25.0,2022-07-13 22:09:01
85b092d0-33f9-4737-b80a-a080fa55035d,A Google user,7/10 Too many in game transactions.,5,0,4.25.3,2022-07-13 21:07:07
8e9160d0-909d-498b-817f-bee68fbb2d61,A Google user,"A bit heavy on the IAPs, and it's a pay to win game, overall great game, fun game, too many passes to purchase",3,0,4.25.3,2022-07-13 20:20:57
b6dc626e-53a7-44ff-a539-3879a79fbbb2,A Google user,a fun strategy game,5,0,4.25.3,2022-07-13 14:39:33
30dfed19-cca0-4e0c-9833-10c50d5321be,A Google user,Very fantastic game,5,0,4.25.0,2022-07-13 05:52:28
7deb87d7-7da0-4c94-b2d4-73180d6ffba3,A Google user,Great game!,5,0,,2022-07-12 23:16:12
3b095cef-cc21-425f-9357-a88fa305dbe2,A Google user,After last update game is barely playable,2,0,4.25.0,2022-07-12 18:04:06
94849adc-7ff1-4e05-a375-1ddb859b8011,A Google user,"I can't plat the game now I have updated it, can you pleases fix this",3,0,4.25.0,2022-07-12 17:15:24
71d721ec-ace8-4864-bffa-b7b7f2ff9296,A Google user,The game is not opening after the last update,3,0,4.25.0,2022-07-12 13:17:54
a7c810e3-5fa3-4713-a97e-40eded104480,A Google user,All good appart from pay to win situation. Basically if you pay you can pretty much non stop use spells which gives you massive advantage. However interesting game.,3,0,4.25.0,2022-07-12 06:37:22
72d4613d-881e-4174-82c5-81b7840069ff,A Google user,Good game but it isnt free. You get a trial wherin you can already purchase upgrades with real money before they tell you that you have to pay for the rest of the game after about 5 levels of game play. Be warned.,1,0,4.25.0,2022-07-12 04:20:22
0ee781ac-64e5-4ff7-8751-ba026739099b,A Google user,Nice time killer. However played it few times (from theb start) and I find the progress slow and no chalange most of the time.,3,0,,2022-07-12 02:58:45
5ef1c324-cf41-41c5-a3f6-5b4917a82008,A Google user,"Great game, lots of ads.",4,0,4.25.0,2022-07-12 01:20:45
1acf3b25-2a22-4379-ae75-2528a28a8ec4,A Google user,"Addicting,",5,0,4.24.3,2022-07-11 19:56:49
67d3a630-593c-4891-8a47-eec05d0a8cea,A Google user,Amazing game,5,0,,2022-07-11 15:52:52
2cd4ee50-cadb-442d-8dbc-a4728a75a977,A Google user,Decent rts,4,0,4.25.0,2022-07-11 14:43:37
6fb38e4c-7b06-435f-8518-cba1282c37f4,A Google user,Love this game but since what appears to be a new update I can't play,3,0,4.25.0,2022-07-11 12:29:37
c04e754b-76dd-40c4-aabe-b68294266b2b,A Google user,Bun !!!,5,0,4.25.0,2022-07-11 05:48:17
e4f17037-d1ce-44e7-829c-cb22b111938e,A Google user,Losing 4 stars since adds don't play. It has been like this for too long.,5,0,4.25.0,2022-07-10 21:01:27
b4917dc8-f012-41c6-a554-84024f661c12,A Google user,This game is my favorite game right now. It is a pure strategy game that is not really comparable to other games that I have played. It is possible to play without paying money (compete with just skill); however you do progress quicker if you buy their monthly pass. They are also starting to increase the number of special events where you can win prizes which also help you progress faster. Overall a great game!,5,13,4.25.0,2022-07-10 20:11:48
39c5cb78-e532-4731-958c-9f15d86f554d,A Google user,One of my favorite games,5,0,,2022-07-10 13:43:29
1f5b51ee-083c-4b4d-827f-77fd77e04318,A Google user,"Last update is creating issues, the game takes too long time to start, and sometimes it takes forever loading in opening chest and getting out of the report after a match",3,0,4.25.0,2022-07-10 10:29:33
1c155c61-14f5-40d7-8fc0-a98d42d56406,A Google user,👍,4,0,4.25.0,2022-07-10 09:17:50
2b9a6290-c30a-401b-8f69-bf62f2e65d25,A Google user,Smoothly,5,0,4.25.0,2022-07-10 07:30:25
937c36dd-96fe-4dcb-a505-101816df3858,A Google user,Good game,5,0,4.25.0,2022-07-10 06:01:40
6d22828b-25c4-4014-abe4-3d3bb9ae2791,A Google user,Itvwas a good game until last update came and it stopped working. It just keep loading and loading. Ti.e to ti.e you ate able to enter game but cannot even start match because each action you do it just keeps loading..,3,0,4.25.0,2022-07-10 01:52:58
a5c8f786-194a-4a0a-b136-195b4fe266be,A Google user,This game is really fun,5,0,4.25.0,2022-07-10 01:40:20
21875a19-65bd-4f4d-98b0-0d5558703699,A Google user,Awesome,5,0,4.25.0,2022-07-10 01:23:53
e3c76f35-753f-420f-87cf-1009d15359f3,A Google user,"Love it, but This updated starting loading screen is soo laggy, that my game doesn't even load many times even after restarting...waiting for a fix",5,0,4.25.0,2022-07-10 00:31:54
2396b23e-c3bb-409c-a30f-86a9a95f9037,A Google user,Great game,5,0,4.25.0,2022-07-09 16:58:23
210bd49f-a56b-4368-8fc1-3a7397abadca,A Google user,Love it. Just wish u didn't have to pay to play the rest of the campaign.,5,0,4.25.0,2022-07-09 15:55:39
776e82ee-505f-4e20-a619-74e2e58817e6,A Google user,"Fun but obvious pay wall, everything requires cash. Every single thing nearly which is ashame because when I see a game that operates in that manner it shows alot about the devs. How can they respect the players when they charge them for nearly all campaigns, the mecha pass costing £38 which is nearly the same price as AAA game release, all custom banners cost cash EVERYTHING $$$$. I understand they want to make money but seriously..... oh and a rating of 600 to be able to plays 2v2s ......",2,4,4.25.0,2022-07-09 13:49:38
ff239488-429c-432f-9ce5-da31c55eb09b,A Google user,Good,5,0,4.25.0,2022-07-09 11:27:41
e91ea203-1885-4cb1-aff9-e72eef698267,A Google user,Nice game !,5,0,4.25.0,2022-07-09 10:28:43
52a02abd-2079-4e07-a6a1-bf52f4d83b21,A Google user,"Great game, way to many pay offers.",3,0,4.25.0,2022-07-09 08:42:19
f2dc6653-d280-4755-99bd-9477e81e8160,A Google user,"This, game is, awesome, I hope they give us a 1 month gold pass gift or premium,. The only problem of this game is the connection in ads sometimes not working and the premium need to add no ads if you buy it so everyone can grind to the awesomeness playing",5,1,4.25.0,2022-07-08 22:14:43
2ba2f0c7-bf8b-4966-854d-34af8aca85ae,A Google user,Game is not loading,4,0,4.25.0,2022-07-08 19:25:37
e2c640ed-b84f-4263-a627-8651474ec811,A Google user,Everything ia back to normal... game is great as always and prob is fixed!!,5,0,4.25.0,2022-07-08 14:29:29
97d61a3b-43d0-48af-9b5e-b157f2f67f76,A Google user,Great game if u have money even better 👏,5,0,4.25.0,2022-07-08 11:27:14
11bcad2c-8e97-499d-8277-7cdf8db1eace,A Google user,Best tower defense game ever,5,0,,2022-07-08 10:21:39
2d0f83d9-dc03-436f-995e-a963ebce34e1,A Google user,Pretty fun game. Though they ask for a lot of money for perks Game won't load after update,1,0,4.25.0,2022-07-08 09:24:04
bfb625b0-0d09-4609-9162-c0c71fbf38c0,A Google user,I love this game but after last update stopped in loading page,1,0,4.25.0,2022-07-08 07:12:46
18c14cb1-2820-46a9-8d15-f9533ec81a58,A Google user,"Seems to be broken now, cannot load",1,1,4.25.0,2022-07-08 03:20:23
a6c8a13b-5c03-4f6f-ac97-fda55a02dfdc,A Google user,"Would have been 5 but there appears to have been an update and now the game won't start, just freezes on the title page",3,0,4.25.0,2022-07-08 00:16:52
5ec9acc0-edea-44bf-a2e0-592f13c3f59f,A Google user,"Loved it in the past but it will no longer open any more. After I spent a bunch of money on upgrades it decided to stop working for me 100%. Tried for days hoping it was an update issue, but it literally died. Don't get into it, you will be disappointed.",1,0,4.25.0,2022-07-08 00:14:47
546a21d3-b85a-4fb1-8cad-cccde63b6a68,A Google user,Game not opening since morning,1,0,4.25.0,2022-07-07 22:56:40
92e67201-ea28-49c4-804e-fcf2d06ee9cf,A Google user,"For the most part I enjoy the game. There are strategic and tactical concepts. Easy to learn how to play yet difficult to master. The match making seems fair enough, but you have to pay to play which I find revolting. You can not face anyone with a battle pass because they have infinite leader power spam over the course of a match while you are limited. With that being said I've rarely come across other players. Just A.I.'s at the moment.",3,13,4.24.3,2022-07-07 17:19:07
577ba380-2d43-41f6-bbce-41888c32baed,A Google user,Highly pay to win. Avoid please,1,0,4.24.3,2022-07-07 17:11:18
9d6c93dc-df86-43c4-a322-9c86782788f1,A Google user,Very addictive game. But waiting for the fourth mission to be available.,5,0,4.25.0,2022-07-07 14:35:45
bffb36a2-7405-4ffc-b66b-e3ccfaea9094,A Google user,the app won't load I play this very often without a problem till this morning. It won't load stays on the main load screen,2,5,4.25.0,2022-07-07 12:23:14
7de623aa-376e-42cf-b147-cdd9e3230648,A Google user,I like this game,5,0,4.25.0,2022-07-07 10:54:05
b7349480-8ee5-4465-b8f1-3fedfbab8a6b,A Google user,Good game.i like it.,5,0,,2022-07-07 05:18:16
e5c369a0-044b-4183-ae00-9731c4b0d2e2,A Google user,Goodgame,5,0,4.24.3,2022-07-06 23:02:36
986d5f04-c21b-473a-8fd0-937b45ef1e51,A Google user,Mushrooms and what not. Scrabble with blue nuts . Something like that . U kno what I'm trying to say,4,0,4.24.3,2022-07-06 21:18:07
862d6c19-67f8-4a8b-8a87-50794a9756b4,A Google user,Extremely Enjoyable :),5,0,,2022-07-06 16:15:55
2af8cd26-7451-4981-8694-0f16ae78193f,A Google user,Very nice games,5,0,4.24.3,2022-07-06 06:17:30
2a13f917-ea7f-4566-97b0-042605783a9c,A Google user,Fun game. Please update Mushroom Trek!,5,0,4.24.3,2022-07-05 21:09:12
d58c7936-d209-46fb-9ebd-8cfb707076aa,A Google user,Im loving it,5,0,4.24.3,2022-07-05 20:02:38
7440774e-d8df-4f42-978d-6382f2a59bbc,A Google user,Character imbalance for online play,1,0,4.24.3,2022-07-05 19:01:15
9d548810-9ac4-423b-a351-8eb8fe9f7367,A Google user,Good game but the amount of lagging on games is ridiculous spent loads on this game and wont be spending another penny and stopping playing all.together you cant manage a simple 1 v 1 witbout crashing wth you got 50 pound packages to buy when the game.will just freeze on you while.playing anyway,2,0,4.24.3,2022-07-05 16:21:07
84cbfd50-a6ab-4294-a112-ba6bf7ccdf53,A Google user,Thumbs up Great game,5,0,4.24.3,2022-07-05 10:35:05
82059e96-8257-40c0-9483-2cabf0e0b9a4,A Google user,i love this game for many years,5,0,4.24.3,2022-07-04 21:12:56
d39e6aa3-1f9e-4044-b9ee-167a7b223add,A Google user,Ok,5,0,4.24.3,2022-07-04 09:54:02
b61bf0a5-0d75-4fa4-85c8-adf41bfcbe6c,A Google user,Definitely one of the best games I have ever played I think progress is a little slow and you have to buy the rest of the campaign other than that its a really fun game five stars 👍,5,0,4.24.3,2022-07-04 05:13:42
94681d3a-314e-41fb-adbc-224517eb0ce8,A Google user,"Excellent gameplay and game design, however one of the most greedy F2P models I've seen",4,0,4.24.3,2022-07-04 01:59:51
722313f8-cbec-4f8d-bad5-62aeede871fd,A Google user,Awesome game so far!,4,0,4.24.3,2022-07-03 21:31:55
1cb81d76-7383-4e90-9e92-a6f705e4dae7,A Google user,Perfect game. All that is left is being sble to get premium with ads,5,0,4.24.3,2022-07-03 18:58:38
621ffb30-2c98-478f-82e6-17547d095f0e,A Google user,The advertising is crazy. every button click. every chest. it's ruining your game. Take it back a bit. we all know we can purchase things.,2,0,4.24.3,2022-07-03 09:07:03
f022574e-7e4f-4e4d-96e9-f871bc468dd3,A Google user,Scammers don't pay anything to them😡,1,0,4.24.3,2022-07-03 05:33:58
27c95317-b3fa-487a-bef6-7b3c6d12e187,A Google user,This game is suck. They are cheater.,1,0,4.24.3,2022-07-03 01:16:15
e6aa4854-7336-4342-a94c-afe451e11055,A Google user,Good,5,0,4.24.2,2022-07-03 00:43:25
6722ff4a-0313-478b-b52f-8f0cb9a6f5e8,A Google user,Great game to pass the time and interesting great ui and fun multiplayer,4,0,4.24.3,2022-07-02 16:27:57
4a80b0fe-8623-4b61-b9d7-7c6ce1f44a55,A Google user,Good,5,0,4.24.3,2022-07-02 14:20:59
15abfe42-07ab-4b96-991c-b7b6a73166d0,A Google user,Thank for this game,5,0,4.24.3,2022-07-02 14:03:17
bf43ba65-e446-440f-9fb6-e751de76d612,A Google user,Nice game,5,0,,2022-07-02 10:47:18
c1a41225-d68e-4343-92c9-4f1da3842fc5,A Google user,Lots of fun,5,0,4.24.3,2022-07-02 09:11:24
006450e8-9839-4354-b19d-56ad64a0e42d,A Google user,lovely one,5,0,4.24.3,2022-07-02 01:50:22
58c6d2c3-c81d-48c0-acaa-23a36a434ffa,A Google user,"Worst game ever. When you go to higher levels, you can't win without purchasing premier with money. Don't fall for such a stupid game",1,0,,2022-07-02 01:37:29
a9d89df9-814f-4d49-9565-414d62d12188,A Google user,As bad as Diablo immortal,1,3,4.24.3,2022-07-01 21:17:15
78b37c16-8663-4258-9af0-c5a20985dcde,A Google user,Nice,5,0,4.24.3,2022-07-01 14:37:43
df727131-2051-4d6d-a537-a3e1412b5b4c,A Google user,Worst balanced online game I have ever seen. I bought the 3 campaigns because the campaign is fun. However you can't level up or upgrade without playing MP. Pay to win is ridiculous. Would highly recommend not wasting your time on this game.,1,0,4.24.3,2022-07-01 07:45:17
16dfbb6f-c6fe-447f-98a6-82cbbaabb104,A Google user,Gem bribe,5,0,4.24.3,2022-07-01 05:20:03
624556d7-a920-437f-8bac-dd74f705cf08,A Google user,"Simple yet competitive! Such a creative game! Easy but hard to master. Best RTS on mobile i think. You can play anytime, anywhere",5,2,4.24.3,2022-07-01 03:32:16
8b10e68c-7aca-4e6b-b1e1-2d41e56cef50,A Google user,Great gameplay not a big fan of the mushroom theme but I overlook that detail because gameplay is good,5,0,4.24.3,2022-06-30 23:28:15
40642b52-1173-40c0-a696-d690838a9575,A Google user,Worth the purchase after the first few levels,5,0,4.24.3,2022-06-30 22:50:42
c6c9764f-b433-437a-aacf-b0ee15f8d566,A Google user,Nice game goood one I love this game,4,0,4.24.3,2022-06-30 12:26:16
dc1ae565-9714-40aa-a99f-93a43f7a5dd1,A Google user,Pretty good game I like the current update but instead of constantly making the player buy a pass with money make it gems instead so you can earn them by saving gems,4,0,4.24.3,2022-06-30 08:37:11
7408d970-0cd0-498d-b0d0-3dfde3008dbf,A Google user,This game favours the defender too much. The person that sits there doing nothing gets more stars and more strength. Also too much payment and regular payments asked for. Want more money than a proper designed game for computer or console. Can you stop forcing players into multi-opponent battles? Especially against vastly more developed opponents. Have separate choice for more than one opponent or one on one. So had to win matches in that format.,1,3,4.24.3,2022-06-30 03:08:06
79ae57fd-f05c-4c5c-b0a5-3156aa092899,A Google user,just the game I've always wanted,5,0,4.24.3,2022-06-30 00:40:37
4a242aa7-4ab6-4880-a361-d059c32ee80d,A Google user,Good 👍,5,0,,2022-06-29 20:20:47
5624202b-e816-496c-b23a-930fe788e594,A Google user,Awsome,5,0,4.24.3,2022-06-29 13:47:47
6b100426-95a6-4ba7-b4cc-6fc3f1e66bb6,A Google user,Great game but lots if cintent locked behind a paywall,3,0,4.24.3,2022-06-29 12:22:16
9b345a41-4ddd-40af-a971-499a85d57913,A Google user,Crazy amount of micro transactions,4,0,4.24.3,2022-06-29 10:38:12
7c9782a6-d238-44d6-9fc5-7db0dcacab96,A Google user,"It says fair online pvp but my friend and I tried playing online, and after 5 matches playing people with max characters we gave up and looked for other games to play",1,1,4.24.3,2022-06-29 09:02:10
ec6c2c3f-cce1-4f33-98e3-aea2566f4ae7,A Google user,When I played this game the first time it was amazing I spent probably more than a few hundred hours playing it but I just remember there being so many microtransactions. The developers will tell you that they're all optional but the game is pay to win in multiplayer tbh. And they're expensive. I won't be downloading the game a second time and I'm leaving this review cuz hopefully they'll learn from their mistakes if they ever make #3 no more pay to win!,2,0,,2022-06-29 08:14:56
33f109c0-8b5c-4a1b-a59c-ad904d10c258,A Google user,😎👌,5,0,,2022-06-28 15:52:58
ad933869-2185-4bb9-b6c2-0587ed10b550,A Google user,"Lots of fun , but you can feel very fast the pay to win. The game is balanced in general. Only the pay to win is anoying coz you cant do anything about it. But on the other hand if you pay you want your money to worth something, and they do here.",4,0,4.24.3,2022-06-28 15:40:06
14c45ea4-9b77-4d87-81af-ba298a88d363,A Google user,"To put it shortly, the game is half-baked. Lightning fast phone and wireless, yet the controls are rough, the graphics are fuzzy, and the loads take ages. Maybe come back in a year or two and these will be smoothed out? This probably has to do with a different developer than the original, which is fantastic. Edit: came back a few years later, game has improved.",4,6,4.24.3,2022-06-28 10:06:14
77fcf961-4ba6-4152-8bf2-00a0a44e21bb,A Google user,fantastic game,5,0,4.24.3,2022-06-28 03:16:36
