id,user,text,rating,likes,app_version,date
bff6e18a-3009-452f-a220-2dd80d438db2,A Google user,Great game kills lots of time really recommended getting the full game. There is a lot of ads but worth it 5o watch one or two now and then lots of campaign which can be challenging if you don't have the right upgrades so think ahead plus pvp is really great.,5,0,4.19.0,2022-01-09 11:49:04
b59a4b39-5d42-41f8-826b-cf69218ac6a6,A Google user,So fun!,5,0,4.19.0,2022-01-09 11:35:50
44967e08-7139-484b-9479-2155026d0666,A Google user,The game does not run at all,1,0,,2022-01-09 11:23:12
1fb44297-14af-40ac-931f-070e6e2bbdd0,A Google user,I've never seen such pay to win. People who pay subscriptions get abilities during battle that just aren't fair by any means. It's a shame they don't have faith in their game and are just going for a money grab. Balance the game and make payments for cosmetics.,1,1,4.19.0,2022-01-09 09:26:53
ed53010c-435e-4035-bf2e-d0985e54e273,A Google user,"Good strategy game, couldn't find a way to turn off the music and sounds... Really annoying. Thier is lots to buy in game but you can earn your way through the game without buying so kudos there.",3,1,4.19.0,2022-01-09 09:23:29
478f31d4-ce9b-489d-a859-fc46e55db503,A Google user,Fun game with a lot of diverse gameplay.,5,0,4.19.0,2022-01-09 06:45:14
6cfd43c2-db0d-48fb-8af7-c1ff6565251f,A Google user,I can't get it to let me in anything but campaign and only up to a certain level,2,0,4.19.0,2022-01-08 23:53:49
09a79016-ab51-492a-ad50-042d3872c8dc,A Google user,I always loved this game...ever since ps3 I wish there was a ps4 or ps5 version,5,0,4.19.0,2022-01-08 21:38:25
fb35acfc-2e86-4177-a7cf-db9e54e04b1c,A Google user,Ok,5,0,4.19.0,2022-01-08 16:52:30
06d3bae3-b3c0-4c10-ab04-80dd162a7016,A Google user,Nice game. Too much ads for prices.,4,0,4.19.0,2022-01-08 13:24:45
fc06f5bf-2f40-4b52-a0a2-774c87eb9e10,A Google user,Yet another pay to win game 👎 Why not just match only free players or only paying players in the battles?,1,0,4.19.0,2022-01-08 09:13:56
ea2b9376-23b1-4a9b-82cc-5d9884287ba6,A Google user,Paytowin,1,0,4.19.0,2022-01-08 07:20:31
028218fb-1b82-40c2-b397-30e583a5245b,A Google user,"USER BEWARE This is a scam app game. Pay attention while you play, it will intentionally make you lose at times even if you have more numbers and better upgraded towers. Game filled with bots to waste your money and time. I thought Google and it's associates were done being this desperate to milk players, disgusting.",1,0,4.19.0,2022-01-08 00:53:42
db2063ef-4e0a-45fd-b223-af03f3619ae6,A Google user,Uneven game. No matter how many upgrades you've made,1,0,4.19.0,2022-01-07 21:03:44
87dd13b6-bedf-47ef-8b46-1680f8f1e27d,A Google user,I like it,3,0,4.19.0,2022-01-07 19:32:47
104038f1-52c7-40a3-b129-48d3bd34118b,A Google user,Well the game is good but I can't continue the campaign why is not free,4,0,4.19.0,2022-01-07 19:08:59
d7fc0bdc-6bc7-491a-9adb-ebc4d9623b87,A Google user,"Amazing, good kill time",5,0,4.19.0,2022-01-07 14:31:24
e4a45649-ccdd-4d77-b760-f4d0caf2c038,A Google user,"Game only works on wifi after a short while of playing (maybe a week). Email help desk tell me its possibly data restrictions. Contact my provider no such restrictions. I have unlimited data, apps use 15GB a month while mushroom wars was using 72mb and is the only app with this issue. I ask for a refund they tell me to to change my service provider? I have tmobile/sprint so if you have that expect to only use wifi. I want my money back!!!",1,0,4.19.0,2022-01-07 14:06:05
4265424a-5e5c-423f-be9d-be335a7531c3,A Google user,"Great game. There's definitely a little bit of a pay-to-win aspect, but it's still possible to win even if you haven't spent a dime.",4,0,4.19.0,2022-01-07 10:09:48
b401bca4-8db6-4400-9743-36e60dfcd0f5,A Google user,Great game dynamic. Too much $$$. Thus another cool looking game falls into the P2W (Pay to win) catagory. I am not a F2P player. I fully think well made games should be paid for. Even think subscription games such as WoW were not badly over priced. But the cash grab games such as these I cannot support and do not support ANYONE ELSE playing this game. Good luck handing your money over to the Devs for a shot at being meh.,1,0,,2022-01-06 14:07:50
9e2b8ce0-d5a6-4481-a112-cf5cf4ee6be9,A Google user,Best game ever,5,0,4.19.0,2022-01-06 13:14:16
2cb17d41-88cb-4a4e-bd06-1264fb768c6a,A Google user,"Very gud Campaign should me go must on I love it I thing manager should give the gifts more,.,,.,..,.............",5,0,4.19.0,2022-01-06 11:31:12
3ce726b2-0717-488b-9f01-ae8c4b27e3f7,A Google user,One of the best rpg games,5,0,4.19.0,2022-01-06 08:41:27
c9d31251-0f13-4aff-9e76-9be294ae3856,A Google user,Highly advice not to play this game cause you'd prolly be disappointed. The game is an absolute Pay to Play. I'm just done losing a winnable game just because my CHARGES that I need for deploying my skills were finished. So garbage of the developers to monetize a really nice game.,1,1,4.19.0,2022-01-06 08:41:06
9a05c348-b437-4ba9-8c3c-d42ec55ab10a,A Google user,Very nice game,5,0,4.19.0,2022-01-06 06:56:48
e0811b63-111e-4198-9d60-e82d94772445,A Google user,لعبه جميله جدا ❤🤩good game,5,0,4.19.0,2022-01-06 05:13:44
7e8b6893-dced-40ce-be11-dab46f69cea3,A Google user,Awesome game just needs a bit less pay to win... Lol,4,0,4.19.0,2022-01-06 03:52:25
4d693356-66f8-4e94-ab60-586146c10360,A Google user,Play to win. Pity you guys destroyed an awesome game.,1,0,4.19.0,2022-01-06 02:04:07
e9030f92-54a8-40a1-a0f7-433ef694efa8,A Google user,"They are cheaters. I have purchaged one pack, they said they give 1000 gems and 31000, gold coind but they give 24000 gold and 300 gems",1,0,4.19.0,2022-01-05 20:17:56
21e20f9c-3095-4fdb-b0c7-5d73d0a1c9ce,A Google user,Super app,5,0,4.19.0,2022-01-05 20:14:23
80cdcde3-abc0-4b2f-a827-c0c7cab4d931,A Google user,Awesome Strategy! ❤️,5,0,4.19.0,2022-01-05 19:08:01
db5e22c1-7114-4932-8e3a-8ad8c66324ae,A Google user,It would not even open,1,0,4.19.0,2022-01-05 14:57:23
675d8e13-b961-4353-9753-dc34acdeced1,A Google user,"O game, trash.",1,0,,2022-01-05 10:13:07
7d51e762-6718-4ec0-a7cd-a04322112782,A Google user,"I think its a great game, it doesn't work without wifi though which can be annoying.",4,0,4.19.0,2022-01-05 10:06:37
b0d39c6c-90c9-4be3-b2ea-d646ac9415d7,A Google user,Paid for all four campaign lines about 2 years ago and still no fourth campaign. If I could get my money back that would be great but knowing how slow this company is that will never happen. Update: almost three years now since I did this and no 4th missing. What a joke company,1,2,3.11.0,2022-01-05 09:01:32
beda0ff9-5e22-4e0d-81f3-fbb009236451,A Google user,Nice game nd grafics,4,0,4.19.0,2022-01-05 06:11:32
19e5f9fd-b696-4b18-b669-80b56a721fdc,A Google user,Good to play but without money you don't play😏,5,0,4.19.0,2022-01-05 00:20:29
a35798ea-3813-4bc3-a082-abd9fe47bfe5,A Google user,Keren gamenya... 👍👍,5,0,4.19.0,2022-01-04 20:53:40
5534787c-c8cf-4368-826c-0d99eebed253,A Google user,Adds and more adds,1,0,,2022-01-04 15:49:20
f65a1678-c7d3-427c-a0f8-46726d92b994,A Google user,Love the game,5,0,4.19.0,2022-01-04 15:14:44
51378a98-d6a8-4855-bd6f-da54c64be697,A Google user,"Sadly, can't efford premium guys please give more option to player's who can't pay..... please 🥺",5,0,4.14.3,2022-01-04 12:45:34
5161df8c-01f4-4938-8b05-2c0a8665e1cd,A Google user,Boring Game,1,0,4.19.0,2022-01-04 11:40:40
e3a1929d-d5dd-4c70-8308-454761634aca,A Google user,When downloading the game it always require WiFi to continue downloading; what if I have no WiFi ?! Also the server connection stability and ping speed are terrible.,1,2,4.19.0,2022-01-04 06:00:17
cb0bc6d9-a4fd-4898-9b38-4a8d4c8774dd,A Google user,"Pay for more version, how to play?",1,0,4.19.0,2022-01-04 02:13:47
fccae382-aed6-4531-a45e-64f7a144b730,A Google user,"Takes a bit of time to workout a good strategy, but then it is fun.",4,0,4.19.0,2022-01-04 01:34:51
98497cce-264d-44aa-867f-ffc622cf6387,A Google user,Exciting gamr,5,0,4.19.0,2022-01-04 01:17:55
457f51bd-4e21-4a3f-8d71-e8da556b26cc,A Google user,Nice,5,0,4.19.0,2022-01-03 20:14:20
56be0387-552e-44ed-92ca-74086cb0f524,A Google user,Basically pay to play,3,0,4.19.0,2022-01-03 18:46:39
748d8337-86d4-45d8-964a-bc672c946525,A Google user,"I would like this game a lot more if premium wasn't so unbalenced. If you are free to play and you are against a premium player, you will most likely lose due to the fact that your energy bank will drain a long time before the game is over. The energy limit of 12 is ridiculus as it regenerates isanely slowly, this drains your energy bank and forces you to watch ads or not play the game for the rest of the day. Maps with speed zones and no environmental objects to block can end in the first minut",1,15,4.19.0,2022-01-03 17:59:16
dfe93751-b5f1-43c7-bc74-ecb03923eefa,A Google user,Pretty good,4,0,4.19.0,2022-01-03 16:18:00
86abbc78-4bf1-4d67-a891-6f7afd153cd5,A Google user,"Lots of bugs, but still playable at times, weird rating system that pits you up against much higher powered players that must have been wasting money on purchases. I think the expansion pack that is coming soon is a total con been waiting for it to come out for a long time. The campaign AI is mental and knows exactly where you are sending troops making it impossible to complete harder difficulty on some of the maps. The overall concept is fine just sloppy execution in parts and full of ads.",2,25,4.19.0,2022-01-03 13:40:35
a5338853-dcb3-4ce8-9031-a99c44b2adcb,A Google user,"Хорошая игра, даже очень Но ооочень много доната",4,0,4.19.0,2022-01-03 11:47:46
d604395c-d68a-4519-b678-79269b61a19d,A Google user,Very late loading please fixed it,1,0,,2022-01-03 09:33:41
d413794b-a74b-4852-b803-9153bb3befe2,A Google user,Enjoy The World yoooooooo,5,0,,2022-01-03 08:58:59
4edb1165-12c8-49be-8ead-aa8e3e16c252,A Google user,"game is not even free, only the demo is free. false advertizing, dont download",1,0,,2022-01-03 08:34:24
a751e7f4-ce2c-4e5a-bd8d-c6765e0e7592,A Google user,So much loading time in offline camping and multiplayer games,1,0,4.19.0,2022-01-03 08:12:53
eaf072c1-10b6-4121-968c-93c2778590c4,A Google user,Super game,5,0,4.19.0,2022-01-03 03:17:07
c3198e4f-a574-48a3-ba39-968ed854b520,A Google user,Good,5,0,4.19.0,2022-01-03 01:49:32
f26b4e49-62d3-4ff7-bf3a-7a085ef2f5e9,A Google user,Love it,5,0,4.19.0,2022-01-02 22:57:44
5bbe47b3-8bf8-4566-af8b-323b24f73aa6,A Google user,"just picked up the game and im absolutely hooked on it. however, there are lots of in game purchases that keeps popping up and it can get pretty annoying...",4,2,4.19.0,2022-01-02 20:07:14
fb0c3502-6d3a-4873-a137-ba49947e3123,A Google user,Alot better than when it first came out,3,0,4.19.0,2022-01-02 19:32:27
4808c112-e225-4fb2-a4ff-03767260f1aa,A Google user,Awesome,5,0,4.19.0,2022-01-02 18:31:37
08043550-f1b8-465e-be99-b9b6be192f0d,A Google user,Amazing Strategy Game!!!!!!,5,0,4.19.0,2022-01-02 16:17:36
319c014e-374e-421b-a7ba-3328f063b442,A Google user,evryting is so much too expensive,3,1,4.19.0,2022-01-02 15:42:34
67c1b746-d42f-4787-8226-c2f48537721e,A Google user,Pay to win,1,0,4.19.0,2022-01-02 13:38:00
a33ee243-7277-45cc-8ee8-bbfe55e5371e,A Google user,Used to be good before they made it pay to win,1,0,,2022-01-02 13:19:21
4f599e35-ffbc-4f86-a4f0-580797e6ff0c,A Google user,Good enough,5,0,4.19.0,2022-01-02 11:07:19
5342581d-12f7-455b-aa2c-7bf1282b3159,A Google user,"Good game fairly balanced a lil pay to win. THOUGH events help, my main issue is that special buildings on some maps are not explained.",4,0,4.19.0,2022-01-02 09:46:19
43c1d28d-a792-4dd7-9302-bd3cfaf8292e,A Google user,Real strategy. You can play without spending.,5,0,4.19.0,2022-01-02 07:42:18
4516e2fc-8965-4964-91ca-9f61ee34215e,A Google user,"Unfortunatly this great game is been disadvantaging people who do not pay to play enough.. Lagging got worse, game matching got worse, glitches got worse. Suport emails have not changed this and therefore I review it at 1 star.",1,4,4.19.0,2022-01-01 18:23:35
604ff396-3593-4b52-b94e-82433beb6121,A Google user,Fantastic game love how they do the game play my only complaints would be how much it pushes buying content and the costs of said content. That being said i have purchased the story and a hero pack just a bit pushy,4,0,4.19.0,2022-01-01 17:23:14
0511e409-22b1-49b3-910e-9da1a5f563ea,A Google user,I like this game,5,0,4.19.0,2022-01-01 14:16:00
dfd02370-0533-4d85-b608-509c15cc455f,A Google user,"Overall a beautiful and entertaining game. It's like a tower defense gone wild. Idk what it is, but it's my favorite strategy game I've ever played.",5,0,4.19.0,2022-01-01 13:04:30
9177f693-455d-4d64-b564-5e63ed2730f4,A Google user,Good game but you can only do so much of the campaign before you pay and it's not that cheap. Also it's just constant add watching,3,0,4.19.0,2022-01-01 10:42:55
b71a08ce-fac3-4c04-9c74-858c2d8ab223,A Google user,Very addictive and very strategic... I did play this game game it originally released bit I found myself coming back to actually purchase the game because it stands out so much from games that are similar... its awesomely strategic and has so many upgradable qualities and that's the one thing that hooks me as a customer/ gamer... there are passive skills for all characters and also upgradable skills for many if the individual characters.... I have been playing for 10+ hours now and I recommend..,5,0,4.19.0,2022-01-01 10:28:06
fd1b8081-740c-4677-bb18-ea4072b7c48c,A Google user,Very addictive!,5,0,4.19.0,2022-01-01 10:19:12
43fc9f7d-10a7-4227-b935-6161542c55bd,A Google user,Awesome game,5,0,4.19.0,2021-12-31 16:56:46
bb645968-564d-4518-93e9-96836eccb4f7,A Google user,Great game looking forward to clan feature soon hopefully,5,0,4.19.0,2021-12-31 15:33:52
04bdcc0e-7ed2-4294-88c3-874985fd290b,A Google user,Молодцы клевая игруля,5,0,4.19.0,2021-12-31 08:16:51
179f35e7-8738-4861-a74b-041e9072dd6f,A Google user,i need premium in order to use my commander to the fullest,1,0,4.19.0,2021-12-31 08:08:35
eda8969e-30c4-4bc1-b1de-568400fcbcd6,A Google user,"The lag in the game is unbearable, impossible to play. Please fix.",4,1,4.19.0,2021-12-31 04:02:59
787df093-057f-4d76-9fc6-5581abaea13c,A Google user,😉😉,5,0,,2021-12-31 03:25:32
578620f9-0d08-4ecd-a25e-ab114e16afd6,A Google user,Shity game.,1,0,4.19.0,2021-12-31 00:05:39
8a8687f7-3a11-4040-aa4e-a6500392317b,A Google user,"Great game, nice graphics, but this is pure micro transaction cancer unfortunately. There are microtransactions that really help you win in multi-player, energy bar, gems, heroes, etc. Also the full campaign is locked behind a paywall. But after all of this 4 stars, with some grind you can play the game and when you do and ignore all the popping screens with buy now the game is really great.",4,7,4.19.0,2021-12-30 22:35:17
98c95bd4-a424-48f2-bda2-b113902a9cc1,A Google user,Nice,5,0,4.19.0,2021-12-30 19:49:24
f99edfce-efad-4ce2-9ce7-48da3d8f7805,A Google user,"very interesting game. very different heroes with different super powers. payed for 1 mont premium, but servers are luck of power. can't enter pvp battle. wait for ages and endup in main menu.",2,1,4.19.0,2021-12-30 14:50:28
401857af-5262-4cfb-8c0b-7c06ebec3974,A Google user,Enjoying the game so far,4,0,4.19.0,2021-12-30 05:55:33
29c90342-61db-420d-9516-299a739aaee6,A Google user,i commend. Tower defense + red alert = this game,5,0,4.19.0,2021-12-30 03:00:15
7537b8df-4959-4f26-9f77-3cdbe3965893,A Google user,"Decent game to spend time in, lots of deals to spend real money constantly but it's not pay to progress. Ads aren't over the top. I'd recommend this game if your okay with slow progression",4,5,4.19.0,2021-12-29 19:06:41
0289a097-022c-442c-bdf0-9175825dc4ca,A Google user,It would be a great game if it wasn't pay to win.,3,0,4.19.0,2021-12-29 18:23:24
b01ecb0a-cfe9-4148-ade6-e98682088f90,A Google user,"Playing on PC steam and mobile, very fun game, the ads are well placed, multiplayer is fun. Keep it up!",5,1,4.19.0,2021-12-29 10:46:34
ae34d255-bcfc-42d2-a2f9-c2d7cb3a9ae5,A Google user,"Game says ""offline"" but you can literally only play five levels. Begs you to get online at every step. Tired of this cash-grab hypocrisy, so uninstalled. Thank the stars I never let it load an ad. It gets one star for great graphics (because I actally can't give zero stars).",1,0,,2021-12-29 09:33:33
32a554b1-b063-41c0-b6f0-6b415db2325a,A Google user,ကျန်အခန်းတွေ ပေူဆော့ရင် ပိုမိုက်မယ်,5,0,4.19.0,2021-12-29 09:30:50
358456cc-acbb-4791-883b-89252402756b,A Google user,They give you a tutorial and 5 missions before you have to pay for the rest of the game. It's not advertised as a demo and it's not made obvious that you have to pay to play. Dirty marketing tactics,1,3,4.19.0,2021-12-29 07:48:27
b8bbaa48-d516-44cb-9d8a-3fc758d3ef77,A Google user,好游戏，好游戏,5,0,4.19.0,2021-12-29 01:27:19
1380ea1d-5c29-489d-bf1b-3b7d69169a48,A Google user,Super,5,0,4.19.0,2021-12-29 00:53:48
6ab53261-d575-4653-9f89-89ac160bf9b5,A Google user,Very very very very excellent game,5,0,4.17.3,2021-12-28 23:47:53
52ba51ea-f77d-4c05-91df-7853d8df39e5,A Google user,"Very good game. Only down side is the wait times for multiplayer, only sometimes though. Maybe once there are more players it will be even less.",5,0,4.19.0,2021-12-28 16:40:43
b8751e05-56b8-4f58-824e-55c7c99dd666,A Google user,Ok,2,0,4.19.0,2021-12-28 16:05:55
e43141c9-d8a1-4b9c-aa40-54d94b9a7914,A Google user,Fun and quick RTS game,5,0,4.19.0,2021-12-28 09:26:10
0e18f26b-33c9-4863-8f6e-fe417ea62c92,A Google user,I love this game but for some reason ranked ain't working on my phone but I still love it,5,0,4.19.0,2021-12-28 08:13:34
8b59a47d-1a02-4b5a-8be8-7ea805f91698,A Google user,Ok game. Not a full version.,3,0,,2021-12-28 08:04:46
896422a3-2545-4246-951b-3d77e34661e8,A Google user,Currently my Favourite game,5,0,4.19.0,2021-12-28 06:41:45
e545d9b4-79b2-4caf-8f38-f759ec9140da,A Google user,"Money grabbing at its worst. Could've had a solid full $4.99 game here.. instead they made it entirely micro-transaction driven, so it's p2p AND p2w. Waste.",1,3,4.19.0,2021-12-28 01:27:48
368a1a32-a47d-49f2-a4d0-bee50a3fd084,A Google user,Stretches my mind to be aware of my true position on the battlefield,5,0,4.19.0,2021-12-28 00:30:46
a7ba5ebf-a7d2-4aa8-9358-53ba5b40a3ea,A Google user,All that matters is the cash grab......,2,0,4.19.0,2021-12-27 23:40:11
2d8f8237-7ed4-492c-9287-c75ceff1aa0a,A Google user,The game was good but you have to pay for the campaign and additional charges. A one time payment would have adequate sense.,2,0,,2021-12-27 17:35:28
697bc00a-241e-4c5a-bb3e-f8b7e343bab2,A Google user,"This is a good game in all. Exciting and brilliant defense game. The only issue is when you start to rank higher the game will level you up with some other players that are beyond your league or level. Its a lose lose situation. Scenario, I dont have 1000 wins yet but I went up against someone with 1000 wins 50 wins in a row and a few other achievements. Im not saying I'm not any good but the levels we are up against. Or players are cheating. Who knows",4,41,4.19.0,2021-12-27 17:35:13
b1cdf0d7-363e-4bfd-8940-11b8efc94fe6,A Google user,"Nice to play, nothing special. After about 5 missions all of a sudden the fun is over completely though if you don't pay",3,0,,2021-12-27 17:01:04
2aa70fe9-a884-4b3b-8fb5-11c9545ea941,A Google user,Awesomeness,5,0,4.19.0,2021-12-27 13:48:26
5ef94bff-c7dc-4881-aa2c-e9284d1b793f,A Google user,So much fun and enjoy...,5,0,4.19.0,2021-12-27 11:28:36
f5b1a2f7-3c80-424c-a80a-2481b3efab94,A Google user,paid to win. its impossible to progress,1,0,4.19.0,2021-12-27 08:23:49
8a603403-7dfa-4904-a77d-f9f1af356022,A Google user,Nice game,5,0,4.19.0,2021-12-27 08:17:09
894fd086-d3c5-4bde-a4a4-c9ae957b5fc4,A Google user,Its good in the beginning only after that it gets worse and all my powers are gone and i can't use them in p v p battles which gives my opponent a better chance to win...its really unfair I am removing this game now just because of this feature or bug...it wasted my time,5,6,4.19.0,2021-12-27 08:14:41
32d10b8f-fffc-4031-bf66-cb930ccdce0a,A Google user,Its cool but change the requirement in 2v2 Its so hard to get 600 trophy and the campaign pls change it too,4,0,4.19.0,2021-12-26 23:13:06
aff765aa-fb8e-4a56-902f-0d530cc8a3c4,A Google user,"This game is clearly aimed at young children, yet the prices you charge are extortionate. I have meet drug dealer with more morals than you scum",1,0,4.19.0,2021-12-26 20:09:13
cf50a214-cf5b-494d-8c71-7898c0978188,A Google user,"Multi-player doesn't work. Campaign isn't free like the first game. The first game is so good, I don't get what happened here",1,0,,2021-12-26 16:33:28
a4f7e6e6-e96a-448a-a74f-31afb7574f3a,A Google user,Good game but frequently crashes and loads VERY slow,3,0,4.19.0,2021-12-26 15:51:34
efdc058d-c110-4dea-b981-b569cb488ad6,A Google user,Bummer that almost the entire game is micro transaction but multilayer us not necessarily pay to win. Still a very fun strategy game,5,1,4.19.0,2021-12-26 15:01:26
f1172bef-23df-4d8e-8184-4caa9b50cece,A Google user,Nice game,5,0,4.19.0,2021-12-26 12:55:52
06c81b99-6697-46e4-812c-85309f636692,A Google user,it's good to play,5,0,4.19.0,2021-12-26 07:45:07
610ba799-6a7f-4fb7-9673-10774c50aa8d,A Google user,Strategy King,5,0,4.19.0,2021-12-26 04:18:18
85eb4ce0-9fe1-416c-aff7-70e872066401,A Google user,Excelente game,5,0,4.19.0,2021-12-26 03:28:47
313e723a-dadc-4f92-bee5-7cecf5150e0a,A Google user,Great game,5,0,4.19.0,2021-12-26 02:24:06
aa6dd99f-238a-4aba-b3b1-c4b908848efc,A Google user,Great game,5,0,4.19.0,2021-12-26 01:55:28
ffaa556e-295a-4c80-9af2-814361bcde0b,A Google user,Fun game. But extremely frustrating progression system. Ranked horrible for new players as its entirely dependent on your upgrades and as soon as you hit gold its extremely difficult to win games vs players fully upgraded. Not even footing for players like first game was.,1,2,4.19.0,2021-12-25 23:23:16
52e57f3d-fc36-4743-a259-e354ee85a14e,A Google user,Another ad that I can't mute that comes through blasting some nonsense but brings me right here for your lovely review. Fix it,1,3,4.19.0,2021-12-25 22:58:05
e2c0a159-9f44-4f88-a995-a25ec7ec9442,A Google user,App hang when play. Connection sudden lost.,5,0,4.19.0,2021-12-25 20:22:37
6ee33110-c2cc-4c94-9b28-728fb99131b0,A Google user,"Fun game, but huge emphasis on microtransactions. Some are very expensive as well.",3,0,4.19.0,2021-12-25 12:24:25
8bd3ba66-dc6d-4dc6-b3fd-f048dff0376f,A Google user,Addicting game,5,0,4.19.0,2021-12-25 09:21:03
251630f4-d3fc-41cf-9f5d-7def5a737c76,A Google user,Game campaign was great that's why I bought it. Been waiting years for the last campaign I already paid for. Been feeling ripped off for years now. Really angry someone should sue them maybe then they will stop their greed in the multiplayer and finish what they promised.,1,7,4.19.0,2021-12-25 08:10:56
86d76d79-f1bc-4b3f-aef5-e06e88672955,A Google user,"I installed this game because I really enjoyed the first part on iOS. Then I also paid extra for campaign and some deals. I STILL get ads and promos whenever I turn on the app, extremely irritating. I feel my money is wasted on this.",1,0,,2021-12-25 07:23:14
f2d569ae-f87d-4501-a428-55e5a62dc5e4,A Google user,Good game,3,0,4.19.0,2021-12-25 07:18:59
fbf08a5f-54c2-4edb-adbc-7e6f94fc78a9,A Google user,"Used to be really fun but now matchmaking is very poor, constantly against superior opponents with no way to win.",2,2,4.19.0,2021-12-25 02:37:01
f8530425-e3ed-4962-930c-eeec7586409b,A Google user,The game hangs a lot and restarts in between. This needs to be fixed at the earliest.,1,2,4.19.0,2021-12-25 01:59:01
ca77d92b-5dd6-48e4-9019-02860a25c4c9,A Google user,Ads haven't worked in a week and you need ads to replenish your health or use gems. Gems are hard to come by when you have to wait two and a half hours just to open a chest and your not guaranteed gems in the chest. Keep getting told it's my internet connection but I sit 15 feet from the box I'm connected to. It also keeps disconnecting from the internet.,1,23,4.19.0,2021-12-25 01:58:27
fc82bed5-c436-4c05-8920-6932fca044ea,A Google user,Bad servers,1,0,4.19.0,2021-12-25 01:57:56
5501d1b0-898c-4e38-893b-701ebe350292,A Google user,Game is fun but issues with server does not let play so often,1,0,4.19.0,2021-12-25 01:33:17
9534977c-105e-4538-8c35-bab7bdf55aed,A Google user,"WORST GAME EVER. THE GAME HAS INTERNAL BIAS, IF YOU ARE WINNING, IT WILL AUTOMATICALLY DIACONNECT YOU FROM THE GAME. NO MATTER HOW STRONG AND RELIABLE YOUR CONNECTION IS, AS LONG AS YOU'RE PLAYING AGAINST A CHINESE PLAYER. IT WILL DISCONNECT YOU. DON'T BOTHER INSTALLING. ABSOLUTE TRASH.",1,0,4.19.0,2021-12-25 01:27:29
af04b5f6-a79e-47c1-9e5e-08367b1232f7,A Google user,Network connection lost i hate mushroom war please guys do not west time,1,0,4.19.0,2021-12-24 22:24:32
c80f454e-1b74-4399-9c4e-cb8d068f9edc,A Google user,"Go figure pay for the premium and now Constantly crashing, can barely play anymore. Great game and concept when you can play.",2,1,4.19.0,2021-12-24 22:08:27
26a80ae9-00f7-4285-aa53-b71a1a9dd8d1,A Google user,Can't enjoy a game that keeps spamming pop ups for micro transactions every 2 minutes Definitely liked the art style,2,0,4.19.0,2021-12-24 17:58:47
13d77b44-b265-400f-8060-f685a191d1fa,A Google user,Good,2,0,4.19.0,2021-12-24 17:35:58
7844e566-3ceb-4e7f-9348-33db44ba2e19,A Google user,"Its all about the dollar, never seen so many promotions and adverts...",1,0,4.19.0,2021-12-24 16:00:41
