id,user,text,rating,likes,app_version,date
364d5f30-4834-497b-b212-c16a739d788d,A Google user,Good but certainly a little pay to win. I like it as a pick up and play game as I bought the campaigns but you have to play multiplayer to progress properly which is a little annoying.,4,0,2023.07.06,2023-08-09 03:11:45
a00ebf87-4284-412d-8f82-6c0d6ef16430,A Google user,Love this game,5,0,2023.07.06,2023-08-08 20:18:21
b16317ae-b640-4275-a03b-9e00237dea3e,A Google user,I like the game,5,0,2023.07.06,2023-08-08 14:06:49
1f0d7666-41b5-47a1-886a-d521783ff572,A Google user,Best game for this style of gameplay. Been playing for YEARS,5,0,2023.07.06,2023-08-07 22:18:32
ab99f01c-e78e-44af-88b5-cd81086e4b4c,A Google user,Hood stuf,5,0,,2023-08-07 13:30:01
9fe5f027-d961-4047-9483-2a03d2eb8c63,A Google user,Love the game,5,0,2023.07.06,2023-08-07 12:27:40
c25463a5-0045-441e-93ca-dc264ff75a4f,A Google user,"If you're poor, you shouldn't download this game. You will only be fed to rich people who can buy their way to victory and the game's staff will make an excuse to make you feel that you're the one to blame, because they don't care about. So don't download it, for your own sake. Make sure that you don't spend your time on a game that only sees poor people as prey, not players",1,2,,2023-08-07 00:07:13
82781d3f-1242-4615-a49b-56c35a2ee76a,A Google user,Fun game,5,0,2023.07.06,2023-08-06 13:11:57
cf9d9b0b-06c0-4f49-b966-cbbff6fc26cf,A Google user,Great game,5,0,2023.07.06,2023-08-05 18:55:25
52d31dbd-63f4-4697-a10d-fc362fc688d4,A Google user,"Love this game. Edit: I used to love this game, now it's elitist and pay to win. Most of the newer characters are completely overpowered, I don't even try anymore. Looks like I'm off to search for a game that's fun that I won't have to spend my paycheck on.",1,0,2023.07.06,2023-08-05 16:37:50
dfedf660-ff70-4cef-b53e-99c505e649f0,A Google user,"If whoever wrote the music is seeing this, I love you",5,0,,2023-08-05 11:47:06
05b9569f-6246-4c78-9825-5fd8d721d219,A Google user,Great game! I like the upgrades.,5,0,2023.07.06,2023-08-05 05:53:29
41fb5ac4-ba93-4153-ada4-8fa501079ba9,A Google user,Bon jeu mais trop de contenu payant et cher !,4,0,2023.07.06,2023-08-05 04:52:00
fa7dd404-c8cd-4a26-978d-08e362a9b45c,A Google user,Nice game,4,0,2023.07.06,2023-08-03 04:45:17
f5d5ce8e-be9d-40fb-864e-d467d3f4d3be,A Google user,A game,5,0,2023.07.06,2023-08-02 11:54:48
5c97ab49-2062-4bd1-8e52-0370bd4f62c1,A Google user,It's a pay to win game of you're ready to pay 100s of usd to win then thts is your game. Instead of giving uneven advantage the game could have used cosmetic products rather than letting ppl pay to win,1,0,2023.07.06,2023-08-02 07:46:57
acd97e67-c87a-4964-9571-65ad2fd2dc85,A Google user,Fun game. Quick to learn slow to master.,5,0,2023.07.06,2023-08-01 06:18:27
93eeb76c-3320-4d3c-ba20-da56340cfa6d,A Google user,It's a fun game when it works. However lately it seems it's full of bugs: several times now some of the mushrooms didnt produce any soldiers and I just had a game where my opponent used a skill and its effect simply didn't end. It lasted for minutes and eventually I got defeated.,2,0,2023.07.06,2023-07-31 16:49:39
512d2eb1-4f33-48aa-bf02-1c589469e4ef,A Google user,"Designed for pay to win. You come up against players who have more of everything with capabilities that you don't know exist until they destroy you. So if you want to play a game that is designed to make a level playing field, only for those with deep pockets, then play it. If not avoid like the plague. Ads galore, completely unequal games = waste of time",1,19,2023.07.06,2023-07-31 08:07:21
125fda92-6891-49f0-ab41-16e7133d55a9,A Google user,Pay to play or watch the adds ......aalot xD,3,0,,2023-07-30 10:34:57
f7349519-115e-42dd-80ef-e161cdef8974,A Google user,"P2w AF but would be such a goos game. The fact that they rub you an ""offer"" under your face after literally, not exagerrating, EVERY GAME is so sick. A game to target the whales, not the RTS And mushroom wars fans",2,0,2023.07.06,2023-07-29 12:43:21
4550156f-5303-48d3-804e-100aced93637,A Google user,Everything is good except the unfair game policy like for low ranked player is matching up with high ranked player where we can't even touch them in the game.,1,1,2023.07.06,2023-07-28 21:52:57
e4888927-3d3c-48d0-a823-cc9495b235b7,A Google user,Liked the game but is over run with cheats lower level player less Territory u can be up by 400 soldiers and boom one attack and ur wiped out like u had nothing,1,0,2023.07.06,2023-07-26 23:45:32
0d099ab5-289f-4411-96c1-837656854d4c,A Google user,update: now playing against high level 40s and 50a. matchmaking still sucks and is unbalanced. 2 common hacks I see people use: take over your buildings without sending any troops. Not sure how they do it... And its not Rudo. Another one: other players can stop you from sending any troops from any building. People can use level 4 skills at start of game as well!! Game is now massively unbalanced since last update as well. Mostly play people in level 40s and get crushed.,1,33,2023.07.06,2023-07-26 11:43:29
d97dd2e3-26f9-43b2-88a8-1997e7664b89,A Google user,Some subject i don’t like,4,0,,2023-07-26 07:09:08
ef2a3fce-bb7a-401c-8060-aee4432fceb4,A Google user,"It's a great game, ruined by excessive and invasive pay to win sales. The developers are not listening to their customers, read the common thread in the reviews!",1,0,2023.07.06,2023-07-25 23:29:15
614e8424-34ba-4419-89f8-d043cc9e6570,A Google user,"Was on, now spamming with adds and pay deals. $189 with 80% off is not a good deal. Also, stop using bots in multi-player games. Player4828990 Dumb!",1,0,2023.07.06,2023-07-24 16:26:41
1832ef88-e833-498a-b0ad-bd322f969444,A Google user,It's really a bummer that the pay wall is so high because the game is really fun. Bought the premium map pack but can't really compete much in PvP unless you pay even more. It's really a shame cause this is one of the most fun mobile games I've played until I hit the paywall.. Edit: Lol at that reply. Ridiculous.,2,1,2023.03.16,2023-07-22 20:52:26
3dfd41d3-94c0-48ed-bafc-933bc917d530,A Google user,I love this game...,5,0,2023.07.06,2023-07-22 07:11:56
d570671c-3cb1-49a4-ba58-ffc3d2edf40a,A Google user,"The game is P2W (Pay to Win), everything, absolutely everything is designed to make you spend money, from the heroes' items to the talents or passive abilities. But that's not the only problem, the matchmaking is broken, like seriously broken. I'm playing with a new hero that I just acquired, and the game pairs me with people who are 300-500 points higher than me. I end up spending about 12 minutes in a match just to win 3 measly cups. What the heck, bro?",1,9,2023.07.06,2023-07-21 12:36:15
b7d82d1b-679f-48d2-b304-be1bccd6e870,A Google user,Pay to win game,3,0,2023.07.06,2023-07-20 23:22:43
41a1e381-487a-4c64-bdc3-19c0c66ea17b,A Google user,"This game is not at all like the mushroom wars I remember. You would pay 10 dollars and have the entire game, multiplayer and story, with no cheap pay to win gimmicks and unfair advantages. Beyond disappointing.",1,0,,2023-07-20 13:03:57
9b88915d-28fb-4e45-8790-98b09edfe3b9,A Google user,Pretty interesting game and very addictive. The only downside I see people complaining about is that it's paid. That's unfair. I think this game and the concept deserves every boost it can. All the very best,5,0,,2023-07-18 13:26:16
cdcaef71-f468-4244-b4e2-f8fa69d00116,A Google user,Amazing gams.,5,0,2023.07.06,2023-07-17 23:28:12
30b985fe-5b1a-472a-94ff-49c56d179da7,A Google user,"It's now about unlocking new hero. It's about the hero charges. With it, this game is absolutely a pay to win",1,1,2023.07.06,2023-07-17 19:17:30
db6edf20-6cfb-496c-a17b-8b54bf99ca3a,A Google user,git gud,4,0,2023.07.06,2023-07-17 05:00:59
46c55ea5-3af5-4afe-94c4-c4576b99438c,A Google user,"I have played this game many times, but every time I have to play against opponents who are not just one or two levels higher than me, but nine to ten levels higher than me. My level is only five. This is why I often have to surrender or get defeated by them. Please address this issue and ensure matches are with players of similar levels.",1,9,2023.07.06,2023-07-17 02:31:41
56ab40a8-1e51-4eba-87f4-a751d13ddb9f,A Google user,"Been playing for 4 years, invested a lot, latest update is dog turd, cup scoring now ludicrous.",1,0,2023.07.06,2023-07-16 23:34:33
a25fd326-2569-4ac0-be77-c709ab6b5bf8,A Google user,Best fun to have,5,0,2023.07.06,2023-07-16 23:28:18
a9ef046e-87f8-44e9-a200-e6d198728c39,A Google user,Great game!,5,0,2023.07.06,2023-07-16 08:11:06
01f7e216-bfd8-47b9-af32-d4f25cc3635c,A Google user,Bad update,1,0,2023.07.06,2023-07-16 06:05:36
e735bd04-aaca-40d0-811d-69e7903d252f,A Google user,"great game, love it - only wish is the ability to make a purchase to remove watching ads to receive rewards from ads - I would pay a solid amount for such a benefit",5,0,2023.07.06,2023-07-15 18:25:14
94291b54-2008-4216-a92a-588ec779d6a8,A Google user,"Brilliant game,I really enjoy it, but paying £6 a month to use the special moves and constant pop ups trying to sell me more things when I've already paid for the game (which I don't mind as it's a good game) some of these things are quite annoying.",3,0,2023.07.06,2023-07-15 12:50:29
d9ade1d9-4a05-439b-bd7a-a904bffc7717,A Google user,The new rating system after the last update is the most ridiculous I have ever seen,1,0,2023.07.06,2023-07-15 11:51:38
6edea509-8790-4794-a989-751da49001c8,A Google user,I am changing from 5 stars to 2 star because the game is definitely awesome but it's way too much one sided for people who purchase create balance if you want to improve the game.,2,1,2023.07.06,2023-07-14 08:09:11
4f17192b-f6fb-41ec-a0f5-e68ff0fc5a03,A Google user,Fun game,5,0,2023.07.06,2023-07-13 22:56:18
9609b959-49c7-4aef-889b-04b45bfa00e1,A Google user,Love it! Great game.,5,0,2023.07.06,2023-07-13 19:40:43
8768f2b7-7f35-438b-806d-f81a855b42eb,A Google user,Matchmaking can be a little frustrating but the challenge is part of the fun!,5,0,2023.07.06,2023-07-12 19:47:43
1eec156e-6ac6-43d4-9991-96098b640267,A Google user,Fun! Challenging,5,0,2023.07.06,2023-07-12 15:30:14
115a0ab5-70e8-4fc6-9561-f81442f93a05,A Google user,This was good years ago. Now the connection has gotten worse and it's just a huge money grab. Not even worth my time playing anymore.,1,0,2023.07.06,2023-07-12 13:36:35
12bf4bd5-ca95-46d0-83c5-cc2f7aac6f28,A Google user,Best time,5,0,2023.07.06,2023-07-12 02:25:43
4d948f0a-8224-4d12-9663-c21a1bd9a502,A Google user,"Good game if you want to spend your time. Similar to defense towers FYI, they force me to write a review, but I don't get my reward.",5,0,2023.05.30,2023-07-11 20:39:02
d9eefba7-fdb9-4e7b-84b2-4c236ed3958f,A Google user,Good,4,0,2023.05.30,2023-07-11 10:06:41
bb392887-5615-43bc-b1db-9b9a447d7377,A Google user,Could be a cool game if they stopped people from attacking right away every single game,1,0,,2023-07-09 22:39:13
70c76975-8560-47df-a497-12cce0f1dd5d,A Google user,I can stop playing this game. There so much do. This game 🎮 is awesome.,5,0,2023.05.30,2023-07-09 09:02:42
04da5614-32e1-41d5-a55b-ab344a5af34b,A Google user,I bought a 4$ pack and never got the stuff from it Super Sale Pack (Mushroom Wars 2: RTS Strategy) how about the support team contacts me instead guy bro buddy dude man sir,1,0,2023.05.30,2023-07-08 19:41:29
9addeb8a-59e1-4c72-8374-d4e3dd24f507,A Google user,"Если оценивать как игру, то 4 из 5. Но как же в ней много доната! Тебя буквально доят всеми возможными способами, что портит игру! И лутбоксы, и энергия, и сундуки открывающиеся часами, и премиум аккаунт... Да, разработка - это не благотворительность. Но посмотреть на тех же ""Riot Games"": донат не мешает играть! Напротив, с удовольствием запрошу деньги в благодарность за их игры, а сюда и копейки жалко. UPD: Спустя ~3 года принципиальных изменений не вижу. Игра хорошая, но донат душит.",1,56,2023.05.30,2023-07-08 15:57:05
b0b723a5-89d7-43c0-91cd-d127ea8bc6aa,A Google user,It has the potential to be a really cool game. But it is let down by the fact that the matchmaking always puts you against much stronger opponents and is completely pay to win with the fact that they can use unlimited skills during a battle whilst you are extremely limited.,2,2,4.20.0,2023-07-08 15:46:37
cf996feb-3ab8-4725-aa37-d09a30414572,A Google user,Not bad. Advertisements were just horrendous,3,0,,2023-07-08 00:44:47
7431c95d-1d57-4d18-bb62-38d4fce87532,A Google user,Fun,5,0,2023.05.30,2023-07-07 13:45:05
b6e037ce-ac95-42fa-8113-503a980cd53f,A Google user,Its complete pay to win dont download it you will regret! Came back after 2 years can't believe they made it more pay 2 win. Still not worth paying to play,1,1,2023.05.30,2023-07-07 13:21:21
f8de12a3-8b8a-44a1-879f-9315e9a18f1c,A Google user,Fw it,5,0,2023.05.30,2023-07-07 10:20:17
2d1fe489-d7bf-475b-b301-d96587ce75c1,A Google user,good,5,0,,2023-07-06 01:10:13
43a3bde9-03c3-49eb-befe-d91e31ad6b64,A Google user,Good game. Quite fun,5,0,2023.05.30,2023-07-04 05:49:02
a9b12421-a6ba-4c38-8297-351e5d6e393a,A Google user,Game is addicting lol.....love it,5,0,2023.05.30,2023-07-03 08:10:44
3455c82b-785e-4f50-9c64-ce094b589e94,A Google user,还不错,4,0,2023.05.30,2023-07-03 00:15:20
6399483a-6c3e-4cd4-a0b1-4c02fb550d30,A Google user,Don't like all the offers and multiplayer is pay-to-win but other than that it is fun.,4,0,2023.05.30,2023-07-02 18:59:17
067f5513-8fba-45ab-b37d-2922429c38e8,A Google user,Awesome.great game for beginners. With higher level it's boring coze you can't compete with those who have the resources. You'll be stuck up in a certain level where you won't be able to proceed further. Since If don't have the resources to upgrade your troops then it's difficult as others will be having a full upgrades heros.,5,0,2023.05.30,2023-07-02 12:15:28
889df39e-f6cc-4e22-9758-c61506b64c17,A Google user,To much pay content 4 / 5,4,0,2023.05.30,2023-06-29 13:09:42
c8a9c415-f550-4243-9c16-3c12375a57d3,A Google user,wow,5,0,2023.05.30,2023-06-29 00:19:02
e2ed353c-fc7d-4e15-8eed-26fcc4d4403f,A Google user,Increíble but transactions still it free so can't complain,5,0,2023.05.30,2023-06-28 20:50:16
c749b7c8-9555-4367-b886-e12c301b8db9,A Google user,"I had a 5 star review as this used to be a balanced game, but now unless you want to dump a bunch of money into this game it becomes quickly worthless to play",1,0,2023.05.30,2023-06-28 14:21:00
8daee09c-ccc3-4bbd-8c16-894bd036eeae,A Google user,"Unless you pay the premium subscription or buy campaigns, this is basically trial access. There are constant pop-up offers of ""generous"" and ""super"" deals that are all $75-100 ""on sale."" I don't think they understand what $1 is worth in games, especially on a mobile platform. The developer's responses to reviews that point out how money-grabbing and P2W it is are saying, ""Play better to beat paying players!"" So... no thanks. I'll take my money and time elsewhere.",2,3,2023.05.30,2023-06-27 01:28:58
1cbb1163-298b-452c-a026-1eb52b64abfc,A Google user,Nice game great enjoy,5,0,2023.05.30,2023-06-26 22:49:22
8fc09725-5fda-421b-b8fb-9de6901375d8,A Google user,Great strategy game,5,0,2023.05.30,2023-06-24 23:00:15
baefd05c-55f7-4e48-921c-c6cb584e0a95,A Google user,super,5,0,2023.05.30,2023-06-23 02:41:17
cea3e164-70b1-43aa-b7da-f9b83ce365ea,A Google user,"This game is basically Auralux with more complicated systems, removing from the minimalist design of the classic original, along with extremely aggressive monetization. Good in theory, not very fun in practice.",2,3,2023.05.30,2023-06-22 22:44:20
23481ded-d5a8-4cb7-a6a1-5450b07ec875,A Google user,I played this game years ago I got it again but I'm gonna have to delete because of this annoying glitch where the screen zooms out and half my phone goes blank I know it's not the phone so please fix it so I can play it again.,3,0,2023.05.30,2023-06-21 18:36:15
8af2ba33-1f22-4282-b96e-6231b442045f,A Google user,Too monetized. And my game started in a language I don't know.,1,2,,2023-06-20 19:43:47
17954564-38bd-403f-9097-febe8f2e5f4e,A Google user,"Good game, definately pay to win though",4,0,2023.05.30,2023-06-20 08:36:04
a85b49a0-1a36-4ea2-8723-9cd0ad526b17,A Google user,Original mushroom wars war was great and Ive played for a very long time. But this game is p2w and buggy. I just disappeared,3,1,2023.05.30,2023-06-19 12:16:03
1e71b29b-0a71-4209-b66f-c254708e1f59,A Google user,Very good game,5,0,2023.05.30,2023-06-18 10:36:15
fb6691b0-560f-40bd-8ea9-113ba44ccc82,A Google user,I played the first one and I've been playing the second for years! Great game!,5,0,2023.05.30,2023-06-17 22:53:00
1fc0459e-b92a-45f5-8ed3-31a2f75776a2,A Google user,"Spent some time playing the campaign until mission 5, only to be met with an optional pay wall that states that you need to pay for each chapter or play multi-player mode to unlock missions. This came after repeatedly being shown ""pay-to-win"" bundles intrusively, some of which were upwards of $70. If I'm going to drop $70 on a title, it will be on a triple A quality game that doesn't have IAP's and that has the content to match how much I spent instead of $5-$40 heroes.",1,14,2023.05.30,2023-06-17 18:23:56
583edfdb-6ec3-4b01-bbaf-8572ccac6c87,A Google user,Great wars,5,0,2023.05.30,2023-06-16 22:37:05
b1c536a9-a6e1-4b6f-85d7-47c74046b9f1,A Google user,Good game,5,0,2023.05.30,2023-06-14 01:35:27
93ce4a2e-d9f2-483f-9731-eb4f934c3fd2,A Google user,It's good,4,0,2023.05.30,2023-06-13 14:37:35
f08eefff-7084-4714-a2a0-11245befd25f,A Google user,Cool et stylé !,4,0,2023.05.30,2023-06-13 11:16:32
ec1e600c-b48c-4094-81a2-6bf3d84b0471,A Google user,Good strategy game,5,0,2023.05.30,2023-06-13 05:50:38
416ac7a0-88e5-4528-9003-f6f5d8e2f16a,A Google user,Was once an amazing strategy game. Now it's been turned into a money grabbing game that's pay to win. Never know if you're going against an enemy of equal tier as you since passive skills are unknown at the start of the battle. Champions are near impossible yo unlock over reasonable time unless you have the premium pass that unlocks chests for you. Being a dollar here and there wouldn't bother me but 39.99 for their equivalent of a battle pass. Great when it first came out and now it's a joke.,1,2,,2023-06-12 14:15:18
114b1456-4b73-4372-8bd7-a933bce06ff7,A Google user,Mushroom wars are some of my favorite games ever. The new monetization has held this game back from how great it could've been. You can keep and grow your player base when you don't monetize. It makes people not want to play because you gotta pay to win.,3,0,,2023-06-12 08:49:45
58176202-8421-481f-8035-2528dcf51157,A Google user,It is funny ☺️,5,0,2023.05.30,2023-06-11 17:03:46
a81c1a17-cfb0-4aa2-a336-10c8efe6c209,A Google user,Hey for all the haters good game if you haven't played the first one then you don't know that you always had to pay for the solo missions. But I play it for the online free multiplayer game it offers let's me waste 2-5 minutes of my down time playing this funny game. So overall you looking for a time killer of 2-5 minutes then pick this game up.And yes pay to win is there but I don't mind since it's just a free game to kill 2-5 minutes of my time going 5 years strong update 6-11-23,5,70,2023.04.27,2023-06-11 12:19:06
f6d26bc4-a437-4be0-9e0c-be2575fbdbd7,A Google user,Love it,5,0,2023.05.30,2023-06-11 08:55:04
88604eb0-3d1b-452e-b7bd-193be770692e,A Google user,"Great game UNTIL ""pay to play"" makes it literally impossible to enjoy the game. The only challenge here is how much money you're willing to spend. Even that wont help for long anyway. Dont believe me. Read the reviews. The developers are lying about the ""free campaign."" Im happy to pay for an actual game. This is just a greedy cash grab BOOOOOOOOOOOOO!!!",2,6,2023.05.30,2023-06-11 05:13:13
c1888568-dced-43d0-9854-64e154b7083a,A Google user,Best example of pay to win. I lost 14 matches in a row last night. Most were either subscribed players with upgraded gear and several tiers of unlocks past me....this makes them 20 to 30% stronger without facing their maxed heros. Most have a 80% plus win rate. It's not frustration that I am playing higher skilled players it's I can't overcome all aspects of a even close to a fair match. The developers could not overcome the odds they put you against. But if you pay you will be like the others.,1,4,2023.05.30,2023-06-11 00:51:02
552f3baa-70c3-4b88-9ccf-98d381f29ca5,A Google user,Love it.,5,0,2023.05.30,2023-06-10 15:16:32
b18bc4ee-58bb-42b9-9c86-7fc74549357b,A Google user,Pay to win hai.,4,0,2023.05.30,2023-06-10 09:12:51
e797eebc-ae70-45ac-be51-85be1dc60b99,A Google user,Great strategy game,5,0,2023.05.30,2023-06-09 10:44:53
6b13ab0d-2624-432f-82a0-5ac8c88e61e4,A Google user,Fun game,5,0,2023.05.30,2023-06-08 15:48:28
f92afe62-fc0f-42ca-98c9-173bb060e1e9,A Google user,nc game,5,0,2023.05.30,2023-06-07 00:35:13
02914335-a92f-4331-9581-9a8316660e68,A Google user,I'm doing this for the gems,4,0,2023.05.30,2023-06-06 08:01:00
61104e2e-5ec6-4c72-bfdc-4fcf310c4b8a,A Google user,Great game,5,0,2023.05.30,2023-06-05 14:35:42
93542109-cabb-4b5d-8bb9-e79545bbc7ce,A Google user,Worst game ever. Full of ads. After some time I reinstalled the game... Lost my old account... cannot get it back. I deleted the game 🎯. Good job guys.,1,0,2023.05.30,2023-06-05 11:32:32
2e6a5edd-5feb-4249-9735-f794a5547927,A Google user,Simply Amazing,5,0,2023.05.30,2023-06-05 09:49:33
b5058ee7-71a1-4bbb-b4ff-16702d2898d2,A Google user,nice game,4,0,2023.05.30,2023-06-05 06:43:36
7fda1a2b-3199-4a11-8023-db4f9cfa56eb,A Google user,Games pay to win. I played it on and off. Just playing the game and not paying it always takes longer then forever. Not worth playing it. Unless you have a lot of money.,2,0,2023.05.30,2023-06-04 20:21:18
98053e6a-9c5b-4f99-b93d-620f4794af60,A Google user,Really fun,5,0,2023.05.30,2023-06-04 14:13:21
a0c2343b-8451-4624-833d-83854842c0be,A Google user,Great game,5,0,2023.04.27,2023-06-04 10:19:57
9772ec3d-58a3-4665-b6dd-0daf38d0428b,A Google user,Love this!,5,0,2023.05.30,2023-06-03 13:59:30
66f46a3c-0363-420e-8954-1d666a3e7f0b,A Google user,"To sum up. U wanna winthe game, pls contribute $$",1,0,2023.05.30,2023-06-03 12:28:29
ad414943-7009-4983-97f8-ceb12d425371,A Google user,"Well made, but they REALLY want your money.",3,0,2023.04.27,2023-06-02 06:26:10
b0035373-54d7-4b2f-befd-8423c0cca980,A Google user,Forest 5-star review for boys,5,0,2023.04.27,2023-06-01 17:37:42
64d9a9c0-0856-4301-9151-906bebc4632f,A Google user,This game is the real pay to win,1,6,2023.04.27,2023-06-01 07:00:41
586f74f7-b993-4ca0-b4c5-cfc10abe6aa1,A Google user,"2vs 2 play. Can you Make it fair? Would like to upload a screenshot of a match, how is this possible?",3,0,2023.04.27,2023-05-31 15:40:53
fc2f98aa-5dab-4247-97a4-15c506f2a20a,A Google user,"Actually the games is super attractive n aways surprise for me. Is very challenging. But have some bug like unique box sometime automatic count the time to unlock sometime not . Second is the energy not unlimited, already super hard n challenge to play 😂. Anyway ,hope have can changes for these.",3,0,2023.04.27,2023-05-31 10:42:19
d85f4b47-a075-4545-8f62-ad38e1d2003c,A Google user,Nice game,5,0,,2023-05-31 09:28:35
572e5ac5-2b3d-48d4-aee4-4058ab6ffc7e,A Google user,Good game,5,0,2023.04.27,2023-05-31 06:54:53
aa480d6d-da42-4f71-b2d2-43e26c26c4c0,A Google user,Cool mushrooms,5,0,2023.04.27,2023-05-31 02:36:13
205a490e-6523-4d22-9c36-dadc5f5e6ccf,A Google user,It's too expensive and they just won't your money,1,0,,2023-05-30 14:54:20
e45031d8-4b48-4af1-af0e-d994324e3741,A Google user,Very fun,5,0,2023.04.27,2023-05-30 10:34:03
bb543e59-685b-4cec-a7b0-aba7d4fc62d1,A Google user,It would be a great game but its pay to win since they added armor.,2,0,2023.04.27,2023-05-29 22:59:13
965744bc-48c7-4914-812b-d0528262a598,A Google user,Норм,4,0,2023.04.27,2023-05-27 10:02:45
ed73483a-f798-4103-983d-17f1622cce70,A Google user,Amazing game!!!!!,5,0,2023.04.27,2023-05-26 13:36:32
795ccff2-abab-41f1-a1d8-de74cd84f528,A Google user,"Really fun game, but serious pay to win vibe",4,0,2023.04.27,2023-05-25 11:04:48
64896b5a-374d-4877-82a7-407cf68ec411,A Google user,I remember playing this game when I was 15 now im 24 I still have the same skill set on this game it was very addictive. I'm really surprised how far the creators of this app updated new features and prizes.,5,0,2023.04.27,2023-05-23 23:46:17
ead288c3-f4fc-483d-8314-32dde838bb23,A Google user,I think one of the best games ever. 5 stars,5,0,2023.04.27,2023-05-23 17:04:08
4c669fd4-6b8f-466b-bd00-e2aa481e52ef,A Google user,"Even though they somehow make the simple game VERY COMPLICATED, you don't know if tapping on the mushrooms upgrade them or not so you wind up LOSING YOUR BATTLES!!",1,0,2023.04.27,2023-05-23 16:12:06
936ea3f8-0d01-4058-b71e-be89bf7a8d06,A Google user,"Long time player, going to uninstall because there is no more balance in the gameplay. I'm either pair with players that don't have a chance or players who I could never beat just based on stats. Only 1 in 10 matches is fun because you have a balanced opponent.",2,2,2023.04.27,2023-05-23 11:59:19
5e9c9208-977c-4fa3-9805-4d57511d2e6b,A Google user,Fun game but items are WAY to expensive to buy,3,0,2023.04.27,2023-05-22 19:33:43
80a38dcc-7ae1-46c3-b439-cd39fcc0f1f9,A Google user,Fun fun,5,0,2023.04.27,2023-05-22 15:39:19
